,Comments,Comment ID,Reply Count,Like Count,Updated At,Viewer Rating
134,"I'm an early transition girl and honestly im really glad you made this video for a few reasons, i can show this to my parents and friends that don't quite get it yet, lucky for me unlike a lot of trans people (that i can't help but feel sorry for them) my dad is fine with it just confused still. 2nd reason is that I personally never understood Non-Binary as a concept but this really helps me get their thoughts, personally won't 100% understand cuz I've never felt like neither M or F, I've always been a girl so I won't know what's that like to think like and the 3rd reason is because this answers questions I never fully know how to answer to people who ask me about being trans, thanks Riley <3",Ugyea2Qsk3xNRRLxBUd4AaABAg,0,10,2019-08-18T16:00:04Z,none
135,Holy Crap! The sibling analogy was brilliant. The world is 20% cooler because of you!,UgycoRorOz5XHCLcXHp4AaABAg,0,1,2019-08-18T15:42:44Z,none
136,"💛💙💜💚❤ 💠🌺⚪🌺💠
Thanks for the vid and all the info you give for those that need to know.",Ugw44qQi3y531-NsBuB4AaABAg,1,16,2019-08-18T15:39:44Z,none
137,"Trans 101? Nice. 

I am super early. Also Riley your HAIR! I love it!!!",UgyctEMNryT3sIErjHp4AaABAg,1,99,2019-08-18T15:34:59Z,none
