Comments,Comment ID,Reply Count,Like Count,Updated At,Host Gender ID
I am suddenly hyperaware of my balls,UgykgM_9pGaj31RwpKV4AaABAg,0,0,2019-12-16T18:34:33Z,1
YOu are adorable. Keep being you <3,UgyC2PP_f0Vfqmm5ZYl4AaABAg,0,0,2019-12-16T10:30:10Z,1
Very nice guy.  Thank you for educating us.,Ugwcab1dmyGqWzHtRE54AaABAg,0,0,2019-12-16T05:48:13Z,1
Isn’t average size 6 inches?,Ugw8y7QXJEIhmR8d7oJ4AaABAg,0,0,2019-12-16T05:38:36Z,1
Can u ejaculate like a biological male?,UgyjHOjSseG3F16ldal4AaABAg,1,0,2019-12-16T05:37:31Z,1
i am so charmed,Ugy5j9buJShHlUW6CI14AaABAg,0,1,2019-12-16T03:37:35Z,1
"wait, do i know your face from tumblr?????????",UgyqGNg1R-SBVSvdydl4AaABAg,0,0,2019-12-16T00:54:53Z,1
bro i have a question will voice also changes after surgery?,Ugxr7zzyslvo7PFDwrR4AaABAg,1,0,2019-12-15T23:41:37Z,1
"I'm glad you were able to get the surgery on the NHS.  I'm proud to live in a country that recognises healthcare as a human right, including top and bottom surgery for trans people",UgwPVORpcFk81jOU_FB4AaABAg,0,0,2019-12-15T16:45:50Z,1
This video just showed up in my suggested videos. Thank you so much for being so brave. I'm not trans I'm gay but love that you are out here educating people. I'm also learning so much from your videos. You are amazing. Oh and adorable. 😁,UgwUmjNVxBm5lgwviqN4AaABAg,0,2,2019-12-15T15:03:58Z,1
"Everyone Else: Asks questions.

Me: Google Images

Edit: Don't look on Google images 😐",UgxI0lL9IGAf-13YuXZ4AaABAg,17,534,2019-12-15T10:53:34Z,1
what do u urinate out of if u have to sit down to pee? i'm confused.....,UgzFsYZpV2I-0R9z-KN4AaABAg,0,0,2019-12-15T01:22:32Z,1
I love him,UgyNMG4j0M-Px0NpsFJ4AaABAg,0,1,2019-12-14T20:49:14Z,1
Thank you for exposing the hard questions that everyone’s dying to know in order to understand. You’re awesome because you’re not offended by them either!,UgypY2x3DYgE8dfuMCx4AaABAg,0,0,2019-12-14T07:57:41Z,1
"Jammi, being a 50 year old gay man, I have spent many years watching my LGBT community change and grow.  Your videos are really something wonderful.  Growing up in the 70's I had no leadership or examples of what a gay man was, not to mention how life was going to be.  Your videos answering questions so honestly are not only helping trans people but the people who support them.  By being so detailed and open your TRULY helping people.  I wish when I was a young boy in the 70's and 80's there was a resource like you to have answered my questions.  I admire what your doing!  Thank you.",Ugz3tLzId0wl6Mwpxe94AaABAg,41,6252,2019-12-14T07:06:52Z,1
"As a cis woman who has always wondered both what having a penis is like and how these types of surgeries actually work, thank you.",UgwDTysgwjV2mJgdRoN4AaABAg,0,0,2019-12-14T07:06:18Z,1
"Christ! I don't want a 10 inch penis anywhere near me! 5-6 inch is my comfort zone as someone who receives penetration, though smaller is perfectly fine. larger is a bit... yeah outside my comfort.
Thank-you for making these videos answering the questions people are curious about but really don't have any right to be asking people.",UgzR2hid4SnmoC56wIh4AaABAg,0,0,2019-12-14T07:02:52Z,1
This is pretty wholesome for a video about genitals,UgwURGJHAqz1Njy6dOp4AaABAg,0,0,2019-12-14T05:53:00Z,1
"I'm a guy and I too pee while sitting, because that usually involve s*itting too. It's efficient.


Unless I'm outdoors (I'm poop-shy) or in crowded/nasty toilet.",UgyCZDL9Z82uj7JnhgB4AaABAg,0,0,2019-12-14T04:51:52Z,1
EGGSICLES OMG HAHAHAHAHA♡♡♡♡♡,Ugwse6tjZ6hizmpbkSp4AaABAg,0,1,2019-12-14T00:22:24Z,1
this is my first video of yours that I'm watching and you're so handsome!! brb watching all of your vids with my Fiance right next to meee! 🥰,Ugw22FV0hVx_zdzq6c94AaABAg,0,1,2019-12-14T00:19:02Z,1
"Man, it sucks that some guys are so hung up on size when it comes to welcoming another brother to the club. What does it matter! Almost all guys would agree that having a dick is preferable to not having one at all!",UgwlrKTuNHl1nunvCTp4AaABAg,0,0,2019-12-13T21:15:27Z,1
I have always been curious about this topic so thank you for making this video,UgzTgRfJjqJd8JUVgbR4AaABAg,0,0,2019-12-13T19:08:54Z,1
"in WHAT world is 7-8"" minimum the average >D >D >D someone got all his sex ed from straight guy porn lololol  

you did fine, sweetie. I'm so happy for you. <3",UgzKCIy-NFxSuarbpop4AaABAg,11,571,2019-12-13T14:49:16Z,1
2:39 That's a lot of -damage- *PENIS*,UgzHIznW_b60iFv-yhh4AaABAg,0,20,2019-12-13T12:54:20Z,1
Someone who thinks a penis is on average 7-8 inches must be heavily influenced by porn ... .and never seen a real penis.,Ugw1YLMAUMeZpoxe4iJ4AaABAg,0,0,2019-12-13T05:55:56Z,1
You’re very sexy!,Ugzn_fURvmR4t0b3ppF4AaABAg,0,1,2019-12-13T05:02:15Z,1
Why tf am I watching this I'm not the target audience at all,UgzzUO6rlawUcG_urPR4AaABAg,1,0,2019-12-12T21:34:48Z,1
"For sitting and peeing. My boyfriend is cis. And he sits to pee when hes at home because he feels comfortable, but if hes at a strangers house or a public washroom he stands to pee since he doesnt feel as comfortable.",UgzDxSriNL_aUeNsj1F4AaABAg,7,410,2019-12-12T19:57:46Z,1
It sucks that you can't choose your penis size because after years of being frustrated with not having one you should be able to make up for it,UgxQkBOlkaGHjw_uvTh4AaABAg,0,0,2019-12-12T18:42:41Z,1
I... I... I wanna see it!,UgwvaAVVMgTN-wjSafZ4AaABAg,0,0,2019-12-12T16:10:38Z,1
"Honestly, it depends largely on the surgeon performing the procedure. I'm an RN, and ive seen some...horrendous work before. Working in the ER, i have also seen some nasty infections from people trying to save money by going to certain...discount medical care countries...which i wont name because the internet doesnt much tolerate negative things about these places...


I have also seen some incredible surgeries where i wasnt even aware that a transition surgery had taken place until being told.


As a rule, with any surgery...if they are offering to do it for a massive discount compared to other surgeons...buyer beware...


Also, congrats on a successful transition (so far) and keep your head up. Some of my favorite people have GD (including my little sister, but that whole situation is complicated, so she might become my brother at some point. It is her preference that we continue with female pronouns until/if she undergoes transition surgery, so all those who want to get on my case about using the wrong pronouns, back it up)",UgyPGWENVsgyXWDJJaV4AaABAg,0,0,2019-12-12T14:53:02Z,1
What a handsome lad 😍 I love learning about this because it's good to understand others.,Ugyd62MDVSGxNK4phCd4AaABAg,0,1,2019-12-12T13:17:49Z,1
Informative! Goes to the category of ''things I'd like to ask but know would make others uncomfortable.'' Thanks for answering!,UgzzQgStGHOr_Gqag4R4AaABAg,0,1,2019-12-12T08:36:38Z,1
‘YoUr onLy a MaN if yOu WaNt a BiGgeR dIcK’,UgwxluMoWNQn75DOOr14AaABAg,0,0,2019-12-12T07:50:31Z,1
thank you this was really informative for e because i have always wanted to know that do men sit on their balls buuut ijust didnt have guts to ask anyone,UgxgW6QBocqjbLZ5ztt4AaABAg,0,1,2019-12-12T06:21:40Z,1
"""-request a monster dick""
  😂😂😂",Ugz6E_QPeCPia87GhC94AaABAg,0,0,2019-12-12T05:08:04Z,1
My only two negative thoughts: why did you say urinal like that? and why did you not have a counter for the amount of times you said squidgy?,Ugx68i41D0oUaQ4-_md4AaABAg,0,3,2019-12-12T03:24:20Z,1
He’s fucking hot,UgxWrf0yRgUgnpSzf7p4AaABAg,0,0,2019-12-12T01:27:41Z,1
I'm not sure why this was in my recommended but it sounded interesting and you're super cute so I clicked it anyway haha,UgzJrZDAHhO1iwvxT694AaABAg,0,0,2019-12-11T23:03:08Z,1
I have a cis guy friend who isnt shy about saying he sits to pee. God knows why he wants to announce it but now you all know too.,Ugw4WV9ZqEepVZZFr9R4AaABAg,2,2,2019-12-11T17:08:26Z,1
"It does not, no.",UgzpjVRHvTOU_tJ6IRJ4AaABAg,0,0,2019-12-11T13:47:06Z,1
You can sit down and pee with a penis you know,UgylVBKb4m7nUAdovv94AaABAg,0,0,2019-12-11T13:03:26Z,1
Hottie 😍,UgzmAVlX8VuqYr42l7N4AaABAg,0,0,2019-12-11T10:30:45Z,1
Why was I recommended this?,Ugy6EcHh1qqLWCWZiAl4AaABAg,0,0,2019-12-11T08:29:35Z,1
Such an interesting video I’m so glad I’ve watched it. Can’t wait to watch your channel,UgxdQ7A0w0lvgeqSTv54AaABAg,0,6,2019-12-11T06:14:50Z,1
"This is amazing. I am giggling because of how cool you are, and your little humour kicks in. I want to adopt you as my little brother. Ow shit how little I knew, but I'm glued to this video. I'm gonna have a flat battery soon 😂",Ugwgn6UJY9Un7i0XwE94AaABAg,0,0,2019-12-11T02:01:13Z,1
This was super educational. Thank you for sharing!,Ugxa6Lw6Zr_gsPsCeTl4AaABAg,0,2,2019-12-11T00:22:51Z,1
"You have the loveliest bubbly personality, I'm obsessed!",UgxrbmJOtns_ex3MEF54AaABAg,0,0,2019-12-10T23:59:41Z,1
jezus christ you talk so fast i cant even understand as someone that doesn't speak english,UgzMDRBRum4lmVasBv14AaABAg,4,4,2019-12-10T22:30:11Z,1
I'm really happy you're enjoying your balls. Balls are fun 😉,UgxuY1E4JfB74NdYAmx4AaABAg,0,0,2019-12-10T20:21:37Z,1
"""I don't want a 7 inch penis that's too much responsibility"" xD",UgyrNiWEtECjL2g6wiF4AaABAg,0,0,2019-12-10T15:30:42Z,1
Probably a TMI but my dad had one artificial testicle lol he was in a horrible car accident and only one of his balls survived. He had myself and my sister with that one ball 🤷‍♀️,Ugyq1ZfyB06cYf0tPPJ4AaABAg,28,2064,2019-12-10T08:54:08Z,1
There's so little in the way of FTM resources that I didn't even know there was more than one type of bottom surgery and now that's something I want to consider looking into more.,UgwOD_TCHVtu06ELsw54AaABAg,0,4,2019-12-10T05:07:20Z,1
"Wait, if you dont pee from the tip, where does it come out if u have balls now?",UgxiFuyOH-7ViYLmFPJ4AaABAg,0,0,2019-12-10T04:52:47Z,1
"We need a counter on how many times he said penis. On a separate note, why am I watching this?",UgxK1ukm_zl1RdbAOFt4AaABAg,0,0,2019-12-10T02:00:51Z,1
"I completely understand the laziness of wanting to sit down to pee! I'm a cis guy and I've been sitting to piss for years, it's the best way to live. Most guys just don't get it because they've never tried it",UgwXQ0yDVjX3qubgBvB4AaABAg,0,2,2019-12-10T00:00:42Z,1
"Oh no, someone doesn't know that the average is around 3-5inches xD",UgzPHRDxYAVpt8xXyat4AaABAg,25,253,2019-12-09T22:48:58Z,1
Actually they say that a larger penis is worse for women. It will actually hurt them and damage their organ,UgycClwEUY6imwbYiAl4AaABAg,0,0,2019-12-09T21:44:17Z,1
Is it still possible to get period (maybe one time in 5 years)? How would this work?,Ugw4mc8EwDce2EuILkR4AaABAg,3,5,2019-12-09T19:49:01Z,1
"Wow i had no idea, here because of YouTube recommends 😜 you’re awesome and thank you for making this video!",Ugw7nSrC-B8zIWvM81h4AaABAg,0,0,2019-12-09T18:39:55Z,1
The midium size penus (While not erected) is 8 cm,UgzYrEM6sFtedqN848V4AaABAg,0,3,2019-12-09T18:06:59Z,1
"This... this is incredibly accurate... also that's a point that needs to be raised he is no different from any other ""cis male""... I can't tell you how many time I have sat on my balls in an uncomfortable way by accident.  It is just life",UgxeGmg5z1WL0t56REh4AaABAg,0,0,2019-12-09T17:19:21Z,1
Thank you for putting yourself out there to make this video. These are questions that I’ve definitely had but was too afraid to ask for fear of offending someone. Thank you!!!,Ugx1y938aVycRLRe7F14AaABAg,0,0,2019-12-09T17:10:35Z,1
"@ Jammidodger I'm an hsp guy; when i feel down i come here to listen someone who is more proud and happy than me to be male. And i feel happy for you. If you, that have struggled so much to be ok with yourself, have reached happiness, maybe there is a possibility to reach it even for me",Ugz9L3ufg3kN9XRpLRp4AaABAg,0,1,2019-12-09T16:06:19Z,1
"""Why do people like this I just want to sit down"" 😂🤣 Same tbh",Ugw-8xRCSWs6DKnGarx4AaABAg,1,3,2019-12-09T10:54:00Z,1
Why is a video about a guy with a small willy in my recommended? 🤨😂,UgxqeYRHQmC1scKzdUd4AaABAg,0,0,2019-12-09T07:49:38Z,1
Videos I watch at 11:30 pm,Ugw3hLBt5J_OQOhdM1J4AaABAg,0,0,2019-12-09T07:11:49Z,1
Thank you for making this video.,UgxpQRQvsCGNSjX6AqB4AaABAg,0,0,2019-12-09T07:00:58Z,1
no one asked if your balls grow hair...?,UgzkPV3MDx5lp71Jq9V4AaABAg,0,0,2019-12-09T06:46:09Z,1
"I'm even more scared now! But i feel good! Like, it's okay to not be sure? And that calms me...but at the same time is scares me even more!",Ugy_e1EJhvfKsVTyq554AaABAg,0,1,2019-12-09T06:26:58Z,1
Thanks for making this!,UgyyannG1IvPykLDMmt4AaABAg,0,0,2019-12-09T05:44:59Z,1
Did you get to  refrigerate any of your eggs before surgery so you can use 1 day?,UgydqdGtle8wXFdZLIp4AaABAg,0,0,2019-12-09T05:14:37Z,1
"As a straight female, married with 2 children I'm not sure how I got here. But I'm happy I did. A lot of questions I've wondered",UgzaA2D1d6u57pB9XmV4AaABAg,0,147,2019-12-09T03:31:39Z,1
These videos are awesome. Thanks for the info I know I shouldn’t care and it’s honestly none of my damn business but I have natural curiosity even tho that’s totally rude.,UgyAklN10Wezu-ddf994AaABAg,0,0,2019-12-09T03:04:37Z,1
"you are so brave and extraordinary for posting a video like this. thank you for helping educate people, and thank you for just being your self!",Ugwc_U8s03jx3UvVfxV4AaABAg,0,1,2019-12-09T01:44:08Z,1
"Hey fella.  I had to drop you a quick message just to say that I admire you so, so much.   I admire your strength of character,  your openness, how genuine you are and your natural ability to explain and educate. It's very kind as well as brave of you to share such an intimate and private part of your life with us all.  It's not easy to do.  You really do have a knack for making others understand and in such a natural, warm and welcoming way.  Your future certainly looks bright, my friend.  It is clear that you have a very wise head on your young shoulders and I'm glad to see the pure happiness that oozes from your eyes.  It is also good to know that you have an excellent support network however large or small you may think it is.  We're all here for you too buddy, supporting you one hundred percent.  Oh and yes, you are absolutely gorgeous too!  Such a beautiful young man.  Carry on believing in yourself, my friend.  Keep smiling and hold your head high.  With much love to you both. A xxx",UgyMd3d7Lf5Hrzf3cht4AaABAg,0,0,2019-12-09T00:22:29Z,1
I've got a question. What happens to your uterus and ovaries?,Ugzs65qiGwsxeBQ8shV4AaABAg,1,3,2019-12-08T23:29:13Z,1
"""I don't want a 7 in penis, that's too much penis, it's too much responsibility! "" Dead 💀 🤣",UgzUNCBgFNuRtbDBsvJ4AaABAg,0,0,2019-12-08T22:00:06Z,1
"My husband is 10 inches and as awesome as it was at the beginning, it hurts me now..even after several children.. not kidding.. especially pregnant 😂",UgxUBFFOkYPrDiBi_Wx4AaABAg,0,1,2019-12-08T21:05:39Z,1
"i dont wanna deal with this dysphoria anymore

cant i just diee",UgxyptW9NAxsIRKgpft4AaABAg,1,3,2019-12-08T21:00:29Z,1
My partner is ftm and I love jammy dodgers. Perfect recommendation from youtube 😊,UgzoVhI_8Zf5HoP-vnJ4AaABAg,1,3,2019-12-08T20:50:53Z,1
"wow, as a trans teen literally all of these options fucking suck and now im depressed about it
i really hope there's better options in about a decade",UgxTL76bwRHl8TP3rrp4AaABAg,0,0,2019-12-08T19:12:53Z,1
For my bottom surgery ima just get a worm on a string,UgxG-XnChpgxwSjEcoF4AaABAg,51,7832,2019-12-08T19:07:18Z,1
"You can piss standing up, it's sorted. Welcome to the male club. Just remember to put the seat down for the ladies.",Ugx2E9prNbNfp2a5XBl4AaABAg,0,0,2019-12-08T14:20:25Z,1
"you are really brave to talk about these topics. i mean, most people wouldnt. but for me, a """"normal"""" female it is so fucking interesting. and you are so honest about it all. thank you.",UgyTwkb-aR2zi22VY0h4AaABAg,0,0,2019-12-08T13:17:01Z,1
"Just found this, cis male here. Welcome to the fantastic world of constantly being aware of your balls. All you are missing is the natural reflex to protect your crotch whenever anything is being thrown at you.",UgzjxSVPPsy46YBcAhh4AaABAg,2,122,2019-12-08T13:12:33Z,1
If you keep your vagina could you have sex using both?,UgzYp8__RbcBhY3hSqZ4AaABAg,0,0,2019-12-08T12:57:07Z,1
Welp. I feel alot better about my penis now. Years of thinking 8in was small...,UgzjRssNfdvaobQnkER4AaABAg,0,0,2019-12-08T12:15:11Z,1
Wait..... Are you telling me you used to be a girl...... ??????? Damn dude... I mean.... is OK?? To call you dude? I guess..  Well you are a dude .... I mean I would never have known you were.... A.... Nahh it Can't be... I need to lay down... Well if it's true... They (and you) did a damn good job.... You look good...,UgwJRVdJdvoqGaOa6yV4AaABAg,0,0,2019-12-08T07:59:14Z,1
You look like cis man. Reakly good looking,UgwSms4zffnYMHDBBLJ4AaABAg,0,0,2019-12-08T04:23:05Z,1
My legs hurt..,Ugwv0PMZxkp45BE-6O14AaABAg,0,0,2019-12-08T04:08:23Z,1
"""That's a lot of penis!"" Omfg I'm dying 😂😂😂😂",UgwKTM_aGnvRAltSZVx4AaABAg,0,0,2019-12-08T03:41:33Z,1
"either you are a man or a woman,  you cannot change your sex....",Ugx0SpEbOTnyed8nWjp4AaABAg,0,0,2019-12-08T03:19:02Z,1
You know you can sit down and pee as a cis guy lol,UgwZo0L2kM7cF98f_314AaABAg,0,1,2019-12-08T02:00:04Z,1
Am I the only one who is picturing what each type look like 😖,UgxyMkcQD5izAeHx_Gt4AaABAg,0,0,2019-12-07T23:40:48Z,1
"the tech age of 2019 is so interesting, to transition and document it online and profit off it. Ive watched a few different people transitioning and not all monetize their sites and sell merch, I'm a free market person so go capitalism and being to able to profit off your journey, I just find it so interesting and dont really have a complete opinion on it yet...not that anyones asking for my opinion, lol.",UgxpZ62YqnetZzS2hvV4AaABAg,0,3,2019-12-07T23:24:53Z,1
🤮🤮🤮🇺🇸,UgwmjSjapMpCpa58QGp4AaABAg,0,0,2019-12-07T21:56:47Z,1
Why trans guys tends to be genuinely really handsome?,Ugx5C_WbEqH32JUymfB4AaABAg,0,8,2019-12-07T21:54:44Z,1
You know what.... thank you. I literally never thought I wanted to know this stuff but I do. And it’s interesting. You hear about m to f all the time but rarely f to m. Thank you for your openness. This was great.,UgzG80tsUZVp0FSS9f94AaABAg,0,3,2019-12-07T21:46:25Z,1
Did he just say “that’s a lot of penis” or did I hear wrong 😂😂😂😭,UgzROnq8H5mfadsqiYN4AaABAg,3,373,2019-12-07T21:22:44Z,1
Im sorry but I need the very personal questions answered. Does the penis work for sex? Do you achieve orgasm? How does cleaning work?,Ugyy0GM5nROTnwguTsJ4AaABAg,0,0,2019-12-07T17:28:30Z,1
I’m i the only person here who was born with a dick and is siting in every position possible just to see if I feel the same as he is describing?😂,UgyHgqgeDK51JNyNdGZ4AaABAg,0,0,2019-12-07T14:09:53Z,1
GOD IS REAL....,UgzUQbnmj2uUOksgdnx4AaABAg,0,0,2019-12-07T06:48:38Z,1
I have a friend who got bottom.   I always was just curious about the details but was too shy to ask cause I dont know him very well.,UgzBVgSpaQLhTwqQgdd4AaABAg,2,14,2019-12-07T06:28:33Z,1
40%,Ugy6bz9hxaFADNXlxYd4AaABAg,0,0,2019-12-07T05:37:20Z,1
💜💜,UgwHJKW_tzK8HXuL-gN4AaABAg,0,0,2019-12-07T04:56:15Z,1
Imitation man,Ugz37wTMw9cJKOGsSxt4AaABAg,0,0,2019-12-07T03:26:13Z,1
Thank you for being so open and candid about such a personal experience/topic,UgwplhzhDJU-AHc3vlB4AaABAg,0,3,2019-12-07T03:20:34Z,1
"The only thing I'm offended by in this video is the butchering of the word ""Urinal""",UgxG4KiV3MR4_0D_Rsd4AaABAg,10,266,2019-12-07T02:34:33Z,1
"thank you for your info.  I know it can be hard to take those steps.  I am fairly sure i am the wrong sex.  but i am old, and poor, so its not gonna happen for me.  I am so glad you were able to get thru it.  I wish you all the happiness life can give you.",UgxIq1tFOOEWh90oDrl4AaABAg,0,0,2019-12-07T02:21:35Z,1
"All im going to say as a cis women i think everyone in general think that bigger is better. No its not. When things are bigger they can hurt thats all im going to say.
Edit: from what i heard this is tru for the back entrance too (i have a lot of very open gay freinds)",UgxUZ9SdDnEf0tjYL4V4AaABAg,1,0,2019-12-07T02:14:47Z,1
My God. The amount of people pandering to this mental illness is incredible. You cannot ever change sex.,Ugzh_nYS9tjA9cYoAkJ4AaABAg,1,0,2019-12-06T23:53:09Z,1
"so is there anything to you besides being transgender? i mean, one would think that after becoming a boy you'd just be a boy, but you seem to be living your whole life as a transgender person rather than a boy. talk about something else, bro.",Ugxyk0Kt4zng18NcVlh4AaABAg,2,0,2019-12-06T23:28:24Z,1
"My fiance's penis is 8 inches & honestly, it hurts me every time we're intimate, especially if we go a couple of days without having sex. Girth matters the most, I think. The walls of the vagina is where most of the pleasure is felt, I believe, anyway. Thank you for this video! It's taught us a lot! Appreciate you❤",UgxLeuHg7Ke8pO8sywB4AaABAg,0,0,2019-12-06T23:17:00Z,1
Thank you for this.  I wanted to share with you that my husband and son are both cis male and pee sitting down so it's not weird.,UgzmkcZ4CCnE7mfAFZl4AaABAg,0,0,2019-12-06T22:37:17Z,1
News Flash! You will never be a man not even close,UgyyTSrMkmnYmXQuimp4AaABAg,1,0,2019-12-06T21:56:06Z,1
Okay but why didn't you get the vibrating and wifi options? Disappointed in you tbh.,UgyPocQii79iKUEt8dV4AaABAg,13,1279,2019-12-06T21:34:54Z,1
"why am i here. i am a cis female. i do not have a trans partner, being ace-aro, and never will.",UgyMZhlmmYNNqGO3giB4AaABAg,0,0,2019-12-06T20:31:08Z,1
Can I just mention that any treatment on the NHS is not free. It's paid for by deductions from a working person's salary.,Ugzl8z3swPAFox0ULO94AaABAg,0,0,2019-12-06T19:56:24Z,1
You look a little bit like Barry Taylor from Sorted.,UgwN-SODXTyf4diYxnF4AaABAg,0,26,2019-12-06T16:10:36Z,1
I have no idea why this was recommended to me but I am grateful because I've learned so much 😚,UgzNCBNPAu_aNWFooGZ4AaABAg,0,27,2019-12-06T16:09:42Z,1
"I need to see the dick... Otherwise, they just don't look real. (but ty for this)",UgzcBni-zDxobVohDst4AaABAg,0,0,2019-12-06T16:05:24Z,1
"From now on they are called tramsgemder people, because the m key on my keyboard identifies as an n key.",UgwI7z35gxn8OvAkQ3B4AaABAg,0,0,2019-12-06T15:02:40Z,1
It's work,UgxCGhFunZFZDtoBLOJ4AaABAg,0,0,2019-12-06T13:07:45Z,1
I don't want to have penis.i want to get taller!!how i wish in this world we have any miracle surgery or treatment that could make some petite people becomes taller.,UgzPIY5pMKVWpKxTW3B4AaABAg,0,0,2019-12-06T10:26:12Z,1
This is obviously very inappropriate for kids but for trans people it can help with future choices in there life's and this doesn't make sense ik ( great vid tho ),UgzOehMPvukHXjryLct4AaABAg,0,0,2019-12-06T08:53:55Z,1
Werk,UgxTpLENqc1ry0KJFBl4AaABAg,0,0,2019-12-06T08:39:16Z,1
Follow up question: are you single? (asking for a friend :P),Ugx_8UKaxYhdWgNhJg54AaABAg,0,1,2019-12-06T05:57:04Z,1
"Thank you for being a role model. Thank you for your honest Q&A, and for showing your decision process on your surgery. I learned so much. Keep being you! I  <3 <3 <3",UgwR3tSWEEV6waLOksh4AaABAg,0,0,2019-12-06T04:41:53Z,1
I have no clue why this was in my recommendations however I’m glad it was. Definitely answered a lot of questions I always had when it comes to bottom surgery for trans men and women.,Ugx0Nyf_lJQVvqSVXFt4AaABAg,0,98,2019-12-06T04:40:00Z,1
God in the US that surgery would cost hundreds of thousands of dollars to maybe in the millions,Ugx6-qmZoBrrlS2-7g54AaABAg,0,0,2019-12-06T03:41:05Z,1
“Monster dick” 😂😂,UgzxtMy0IC1RQI5WSnB4AaABAg,0,0,2019-12-06T03:33:59Z,1
10 inch penis Jesus Christ .,UgwPtvbRs1qZ-cRh9JJ4AaABAg,0,0,2019-12-06T03:32:46Z,1
Why can't we pick the size of our penisssssss😭😭😭,Ugy931G8WsdRsp5pLhV4AaABAg,2,4,2019-12-06T03:09:15Z,1
2:25 that's what I'm thinkinggg why not? not transphobic actually Bisexual and Transgender and wants more info how lower surgery works. I'd like to have it someday.,UgzeplLwxhcEfBKdDzd4AaABAg,0,0,2019-12-06T03:06:48Z,1
So if you were to commit a federal crime would you be in a females  prison or a males prison? 🤔 just curious lol,UgzeFoKZsIEB7Pk9wcZ4AaABAg,0,0,2019-12-06T02:13:27Z,1
I could never tell you were born as a girl but you act very girly.,UgxS7e-AKEvFuU99kkN4AaABAg,0,0,2019-12-05T22:45:37Z,1
Wait you're FTM? Holy crap I watched most of this wondering how you knew so much about all of this and then I read the comments and I was like whoa! That's amazing. You transitioned very well physically!,UgwmCh15urx30jcSfwp4AaABAg,0,2,2019-12-05T21:21:45Z,1
"Do you still have to get regular screenings for cervical cancer? If so, how are they performed if the vaginal opening has been closed?",Ugxes1mfFAbk-fQcl1Z4AaABAg,0,0,2019-12-05T21:20:08Z,1
"let me tell you something? i would never thought that you were another gender physically, that's amazing, you are very beautiful man:3",UgwzUun2aCiFCcrTia54AaABAg,0,1,2019-12-05T20:38:39Z,1
Glad to see Youtube recommending this video to me.,Ugytbf-4_OuneS7gXpd4AaABAg,0,0,2019-12-05T14:59:30Z,1
"Girl you right, it’s way too much responsibility",UgyAizvSVPQVrWM_fxh4AaABAg,2,0,2019-12-05T13:42:31Z,1
you remind me of how to train your dragon guy.... hiccup?,UgyB60K-xbTQwKJ2-HN4AaABAg,0,2,2019-12-05T11:37:31Z,1
