,Comments,Comment ID,Reply Count,Like Count,Updated At,Viewer Rating
0,"Love from India...nd i want to talk about the transaction , can we talk?...",UgxLghVkV0WAwgNOJcB4AaABAg,0,0,2022-05-24T11:57:44Z,none
1,"I'm really happy for u Jamie Bro, not everyone gets the life they want, and a partner who supports no matter what...💪❣️",UgyRsvrO84Dez08kZX14AaABAg,0,0,2022-05-23T16:10:01Z,none
2,"Thank you with all my heart. I was finaly ready to find out. And you are a source of information I trust 
I am pretty sure I'm non-binary. But something tells me there is a possibility I am trans :S That scares me a lot. 
And long before findeing out that Im not cis, I was wondering about this. So now.. Oh dear 
Thank you for helping me in my journey",UgwnPxWPIuiy1dweLdV4AaABAg,0,0,2022-05-21T18:19:27Z,none
3,That's it I'm getting bottom surgery when I can afford it,UgwpDyoNZA2sxB_w63N4AaABAg,0,0,2022-05-21T03:13:31Z,none
4,"As a biological man, I find it interesting to see your idea of what being a man is. Is like if you only have a very stereotypical image of what a man is. I wish you could have better mental health. Having a beard, does not make you a man, having testicles does not make you a man. Having a fake penis does not make you a man, your country spends so much money in these operations when so many people with really health issues need it. Very upsetting to see your county paying for this,.",UgyTZSxx2rYOadPaO1p4AaABAg,1,1,2022-05-24T01:57:45Z,none
5,Eww,UgwVSZ7PjypUzm_EguJ4AaABAg,0,0,2022-05-18T16:27:45Z,none
6,"Why is every photo of surgery results so horrific, it feels like they intentionally take the most bloody/scarred/disfigured/poorly-lit photograph imaginable. I'm considering this for myself, but I can't find images that are post-recovery; I'm trying to find photos that are months/years post-surgery. A ton of photos online are literally mid-surgery.",UgwFyRvp4d0zpmC42CF4AaABAg,0,0,2022-05-14T23:21:52Z,none
7,I found this very interesting. The only thing is he/she can’t really answer accurately when he/she doesn’t know what it actually feels like to have a real penis and balls.,UgwKKagrZgK6Yuiu4qh4AaABAg,0,1,2022-05-14T14:45:18Z,none
8,"I need to know is it possible to still get periods after bottome surgery? Like day you have to stop taking t st some point, is it possible to still some how bleed? Or would it judt be cramps? Or is it just not possible to have it?",UgwXOwTIjgFxs_s3rSZ4AaABAg,0,0,2022-05-14T05:58:55Z,none
9,Question I'm starting testosterone very soon you mentioned micropenis does that mean I will grow one once I start testosterone? I'm asking out of curiosity and I already have been told from blood work from my PCP in 2015 I have high testosterone levels in my blood and don't know why when I'm born a female of course and yes I'm going for top surgery first to start,UgxHZ3xJOzQPPFhDsoh4AaABAg,0,0,2022-05-12T01:31:31Z,none
10,"LOL on the question why did you get a size 8-10 penis, my answer would have been I would never want a woman with a man whole virginia 😅and by the way there are many cis guy's who can't produce sperm, as long as you and your wife is happy that's all that matters, thanks for the informative video handsome brother and for letting us here how stupid people are with their questions, question that they would never ask a cis guy period.",Ugwk54jKYlSZ1r-h37x4AaABAg,0,1,2022-05-10T14:52:20Z,none
11,I have a question for you. If you get merried do you think you can produce babies after this operation,UgwlxvW4IRPAt7s-pBp4AaABAg,0,0,2022-05-10T04:35:44Z,none
12,You're out of breath because youre on fake testo?,UgwxFB8QQoHtaLytIg14AaABAg,0,0,2022-05-09T17:51:17Z,none
13,"I'm slightly confused as to why you thought getting the stuff that would allow you to pee standing up would prevent you from peeing while sat.

I've got a cis penis (okay kinda, and hopefully not forever, but either way point is it's a born penis that's had a male puberty, and used to have sperm) and while I'm still entirely capable of peeing while standing up (although I haven't in at least 6 months now), I definitely can, and always could (so back when I had normal male Testosterone levels) pee sitting down.

Ask any man, cis included, whether they can pee sitting down, and you'll either receive a ""yes"" or they're super toxic and think men aren't allowed to (but they're still physically capable).

Yes it occasionally bumps against the toilet's wall but just sit a tiny bit further back and that's solved",UgwPXcfQiHuBCVcdzG94AaABAg,0,0,2022-05-06T07:26:53Z,none
14,what does sex feel like? i’m trans ftm and want to be able to have lots of feeling if i had penetrative sex,UgwshxY_gq7uGdGEID94AaABAg,0,0,2022-05-06T00:16:52Z,none
15,"Super interesting, thank you for being so open:)",UgxPDgQE-BSTKGYxrHZ4AaABAg,0,0,2022-05-05T19:55:25Z,none
16,You are so wholesome <3,UgzAPOwmVuoIdPL4CJ14AaABAg,0,0,2022-05-02T18:24:23Z,none
17,"Q: Does it look like an eggplant?
A: Well, ...

Q: Does it behave like an eggplant?
A: Well, ...

Q: Can you use it like an eggplant?
A: Well, ... 

Q: But you still want to call it an eggplant?
A: Yes.",UgyiHUACnxUwrmdL04N4AaABAg,0,0,2022-05-01T15:10:03Z,none
18,"So basically the answer to all the questions are. ""It's basically like a cis male."" Dude look it up, you can see the difference for yourself.",UgwJmx9JCmjXGXq74d14AaABAg,0,0,2022-04-23T16:40:39Z,none
19,"Fabulous video, so happy for you!  BTW, I HATE the faint, bell-like background 🎶  music.  Please don't do that!",UgywtDGu1ic5kSPlqXd4AaABAg,0,0,2022-04-23T05:30:58Z,none
20,"When do the chromosomes transform?  wait...they don't?
Does the prostate affect the erection like in a normal penis during climax?    wait...there's no prostate?
If you change your mind, can you get your vag back?
This is sad that someone would do that to their body just to try to be something they're not.",UgxdLp86SoeWgwR0Oy94AaABAg,0,0,2022-04-20T03:53:03Z,none
21,😅😅😅I'm a heterosexual female but this is hilarious,UgzKzhRXcQrvdbIB6x94AaABAg,0,0,2022-04-16T17:30:16Z,none
22,Another option is you can take mine I don’t want it,Ugx3M0dGBre0a--ys9p4AaABAg,0,1,2022-04-14T03:03:07Z,none
23,What do they do with the vagina and cervix when they do bottom surgery?,UgwPv5nHtoNFszJTpkV4AaABAg,0,0,2022-04-13T13:32:51Z,none
24,"As a aro-ace person who doesn’t have the courage to come out, You really make me feel good about myself",UgyKCE4LSPOOCASFM9V4AaABAg,0,2,2022-04-11T14:40:04Z,none
25,Omg that's so sad,UgwoIgQhiIwWJgorbBB4AaABAg,0,0,2022-04-07T18:45:15Z,none
26,Very informative thank you,Ugz8FpmncOPUs-piMqJ4AaABAg,0,0,2022-04-06T22:44:49Z,none
27,I have a dream of being able to rail a girl but I have no other reason to transition so I won't I guess 🤷🏻,UgwQhluu5XibZvKtQ4x4AaABAg,0,0,2022-04-03T22:25:12Z,none
28,"Hearing about your experiences with your balls, how can anyone say you are not a man? Like... I just... The entire time I was just ""Yep, that's what it's like.""
(Please note that this does not mean a trans man needs surgery to be a man.)",Ugxbk6vIFJAr4TuhtzV4AaABAg,0,1,2022-04-02T13:15:05Z,none
29,I love how open you are! 🙂🙂,Ugyd0zEecahoWQXvmR94AaABAg,0,1,2022-04-01T20:01:06Z,none
30,Will you effin just show us your globbam peanuts instead of going on and on on with 1000's of words? Jeezuz. You keep repeating yourself too. Ever here the expression a picture is worth a 1000 words? It's not strictly true but I think you get the idea.,UgxKfhyIFT2YeUUAbth4AaABAg,0,0,2022-03-31T22:56:50Z,none
31,"It's kind of weird that some trans men opt for a big penis (far bigger than average), because what? A big penis means you're more man? Kind of contradictory.",Ugyve56XimJ831-dP-J4AaABAg,0,0,2022-03-31T11:12:22Z,none
32,What does your girlfriend want I'm sure she'd like a real penis,UgyAXU0b0iEagS_ui-J4AaABAg,0,0,2022-03-31T02:08:34Z,none
33,"I'm very late to this video, so I doubt anyone will answer me, but I'm a cis woman, and I'm curious as to what you did for your period/women needs? Did you get your tubes tied? Is that hole still there? This question is really just for any trans male. And if you're a trans female, is there such a thing as bottom surgery for you? And what's that like?",UgypdKiXLfbtTW67Nsd4AaABAg,0,0,2022-03-29T03:06:59Z,none
34,"I'm so glad I stumbled across this. I've been a bit late to transitioning only now looking to start testosterone at age 29, and your videos have tackled a lot of the fears I'd put off until now. I'm finally going to be calling my doctor today, so thank you for being so informative and helpful! Can't wait to finally start into my own journey :)",UgyEgTHp1JwlPy25B0J4AaABAg,0,0,2022-03-18T19:05:00Z,none
35,Mental,UgzseZmeOz4zPP_OLE14AaABAg,1,1,2022-03-18T14:26:50Z,none
36,5:24 ……..ANYMORE!?!?,Ugy4Kc4UJGwO-kpppCt4AaABAg,0,0,2022-03-18T13:17:42Z,none
37,I’ve always wanted to know if it looked real bc I’m a trans guy myself (not transitioned yet),Ugy3FjACHKUNsvXYOxV4AaABAg,0,0,2022-03-17T17:36:26Z,none
38,"I’ve heard some have issues with pee leaking out the first few months after bottom surgery… now im not asking If you had that specific issue, but which of the types of surgery would have less chance of that sideeffect?",UgzO3cE4HVFseGt-59p4AaABAg,0,0,2022-03-17T13:08:25Z,none
39,“That’s a lot of penis” lmfao  .. hilarious,Ugxc7N0_zjY0AxUaydl4AaABAg,0,0,2022-03-14T07:26:33Z,none
40,"Take a shot every time he says penis



Rip 💀",Ugw5kByjrGEhs1fJfRh4AaABAg,0,0,2022-03-14T07:25:04Z,none
41,"I d assume, most likeley, whoever said go for 10 inches is a guy. (25,5 in cm).",UgyLPhMxGoiiBzUo3b54AaABAg,0,0,2022-03-10T02:21:06Z,none
42,"i do wish you had answered if the surgery/healing process hurt, because that’s something that im most scared of even though ive always wanted bottom surgery. the cost, look, feel, and everything never really mattered as much to me. i know i will be happy with what i get and i know it will be worth it no matter how expensive, but im terrified of the pain. im scared of being hurt and alone and there is no one to help me or soothe the pain. sorry im getting a lil personal lmao but if theres any ftm guys in this comment section that have had bottom surgery id love to hear what it felt like physically. thank you for making this video jammi, it helps a lot of people like me feel less alone ❤️",UgyCDBYInKWxddVGRFh4AaABAg,0,1,2022-02-28T04:39:21Z,none
43,Nice video but.....men we will always want a bigger pinus...be carefull next time you talk about size because It give all that away women dont care of male size  genitalia!,Ugy6lUj2l7MLLNyl2gF4AaABAg,0,0,2022-02-24T21:03:38Z,none
44,"take a shot every time he says penis
(please dont actually do this)",UgwfVfdP5yBKvfY472V4AaABAg,0,1,2022-02-23T19:28:11Z,none
45,I’m a young trans guy and I don’t know much about bottom surgery and this really helped. Befor now I didn’t even know there was more than one surgery!,UgxihhoCi-5EQHNsgWl4AaABAg,0,2,2022-02-21T02:32:29Z,none
46,"Monster pnises are only for jokes. The reality is, women do not want to mate with a horse. They are painful and uncomfortable to accommodate, as well as intimidating. There, I said it",Ugw_zF4FneJb1pTHvpx4AaABAg,0,0,2022-02-20T01:22:58Z,none
47,"A dude with ovaries and PMS?  This lady should have known better, the mutilating surgeries, very expensive ones, and horse hormones are turning her into a hybrid looking woman.  She is unable to understand that manhood is a lot more than a halloween costume.  She looks ridiculous.",UgzThWi_e-FXu_PtYbx4AaABAg,3,0,2022-02-18T09:24:35Z,none
48,"Me, an American, recently found out I could get all my surgeries and aftercare for almost free as long as I'm on state sponsored care. I'm happy I don't have to pay upwards of 10k-20k in order to have it. But I gotta live basically almost on the streets to qualify..",UgyrGZY-2-jlC0bJSnN4AaABAg,0,0,2022-02-17T16:07:48Z,none
49,I'm likely not going to get it due to the fact I'd much rather have the growth (if any) that I'll get because I'm nervous about that kind of thing. I've seen what I don't want but what I do want is feeling and function as normal as possible. That way I don't end up regretting the surgery. Definitely want top surgery though.,Ugzu3vX3D9GjzfNdYRd4AaABAg,0,0,2022-02-17T15:56:41Z,none
50,"So, you looked at boys and told yourself ""I wish I was one of them?""
Is it what happened?",UgwDecpcZPE5IvEPFZR4AaABAg,1,0,2022-02-16T15:50:14Z,none
51,"love the information, love the channel, love you!! ... it is really appreciated as a cis male with a trans male sibling this is so immensely helpful. thank you thank you thank you!!!!",Ugz7-LwNe2EjXS0Jhh94AaABAg,0,0,2022-02-15T05:23:21Z,none
52,"With getting the bottom surgery I have always had one concern or needless to say questions whether or not you choose to go through with all the surgeries or not, WHAT IS IT LIKE WHENEVER YOU CLIMAX, OR HAVE AN Orgasm",Ugw3InGwRDcDDIVckDN4AaABAg,0,0,2022-02-09T15:43:58Z,none
53,Does it look circumcised or not?,UgwhKb99hJtUwt2PPSx4AaABAg,0,1,2022-02-02T01:38:32Z,none
54,I have a question if you take testosterone would you have to grow a beard or you have to take pills that grow beard or you don’t need to grow a beard I don’t know how to ask question I’m sorry,UgybKztI1X0SIhJGy8V4AaABAg,3,2,2022-01-29T08:43:50Z,none
55,i mean what size is the one u got,UgyUjzcYWp4oSTGgzbB4AaABAg,0,0,2022-01-27T16:45:50Z,none
56,that surgery did u have,UgwmfrfkQThqv0P7t_Z4AaABAg,0,0,2022-01-27T16:44:46Z,none
57,"Thank you so much for being so open, honest, and willing to share the details of something so personal. I've always had a genuine curiosity on the medical and anatomical aspects of this type of surgery but was aware that that curiosity could be perceived as something more salacious and intrusive than it was intended. You didn't owe anyone these intimate details, but I am grateful for the education you've provided. I've always liked all of your videos and am so happy that you have found your peace.",Ugz2SnBSrhwZ7yER7ZZ4AaABAg,0,5,2022-01-25T06:30:34Z,none
58,"Phaloplasty is really in the dark ages. Do your research. Loads of problems. Fistulas. Sepsis. Tears. Further surgeries. Lifelong issues. Oh. And no orgasm.
Don't believe the hype.",Ugw-9dfe9kHecDpKEup4AaABAg,2,0,2022-01-21T04:13:37Z,none
59,Just found out about a mate went through the change. I hope you're happy God willing I can be a good support. You be you Boo,UgwvVTKIGEDYHjST9HF4AaABAg,0,1,2022-01-19T16:21:50Z,none
60,"Oh gosh this was helpful, thank you! As a trans male this makes me feel a bit more better",Ugz3KMc1YWiVDRHB2yR4AaABAg,0,1,2022-01-16T00:08:09Z,none
61,Wow the subtitles really can’t spell metoidioplasty. (Not sure I can to be fair but it’s better than what subtitles were coming up with),UgzyQvAGcUz_nHl3Egp4AaABAg,0,1,2022-01-15T15:59:41Z,none
62,the fact that there was a add about church before this is just-i cant,Ugx7EX_7GXaG3ctKeWJ4AaABAg,0,3,2022-01-14T12:44:08Z,none
63,"the constructed penis is made out of the clitoris, right? so is there a way to still have a vagina after surgery? I'm a trans guy but I'm really into vaginal penetration but still get plenty of genital dysphoria. however I don't think I'd be fully comfortable with genitals resembling a cis guy's. having a penis but also a vagina seems like fun.",Ugy1XgWBPzHZEqcIVKV4AaABAg,1,2,2022-01-13T18:06:24Z,none
64,I love your perspective on size ☺️,UgyTd6AcE8oRqoTy1pJ4AaABAg,0,1,2022-01-12T19:19:43Z,none
65,SOMEONE THOUGHT THAT THE BALLS WOULD FALL OFF??? THAT SOUNDS HORRIFYING-,UgyTmhqPpULkduArJGx4AaABAg,1,2,2022-01-11T04:42:42Z,none
66,"ok guys help i'm trans (i thinkkkk??) but i'm going to a new school and its a christian all girls school and what do i do??? Like if i come out and start my transition will they kick me out? I'm also not entirely sure if i'm trans (f to m) or gender fluid. Like it always felt wrong when someone called me a girl. I've always been very tomboyish my whole life such as cutting my hair like a boy. I felt happy when someone mistakes me for a boy. I remember seeing boys being friends when i was like 6 and thinking it would be cooler and better to be a boy. It was always sorr of nagging me. Then i had some crushed on girls and though i was lesbian and now i'm realising i could just be a straight guy? When i began  puberty i hated my body so much!!

Idk whats going on but somebody help i'm 13 and abt to start high school.",Ugx4teQJiiP_CCLgntV4AaABAg,1,0,2022-01-10T11:48:42Z,none
67,Babydicks need more recognition 😕,Ugybp0okQ8S4FnemmLR4AaABAg,0,2,2022-01-10T10:44:58Z,none
68,This guy so cute 🥰,Ugzy3TwELqSMg41-3eV4AaABAg,0,3,2022-01-10T03:47:36Z,none
69,I just came out as trans (MTF) to my sibling (NB) and it was very euphoric. And your videos are helping me *so much 😀*,Ugw-K8gpqU49CjV-UFt4AaABAg,0,1,2022-01-06T06:25:28Z,none
70,"Hey! 
I’m a quite young trans guy (I changed my name and pronouns about a year ago)
And I’m really sure I want top surgery and hormones! But bottom surgery scares me a lot, I have no idea if I want it, I mean, I do but I’m scared because maybe I will not like it????
I’m so happy you said you at first didn’t neccesarely wanted it too but after having top surgery you did. Because I obviously haven’t had top surgery yet, nor hormones!
Having a boyfriend doesn’t help too, since he’s a cis guy he doesn’t have that problem and it makes me jealous af…:(",UgyQfHfZ9kJjjHFmdGx4AaABAg,5,1,2022-01-04T21:51:52Z,none
71,"I don't mean to sound offensive but you totally look like a naturally born male, I wouldn't have know you weren't otherwise",UgyLkYSgB6r8QbKytD54AaABAg,1,3,2022-01-01T04:09:15Z,none
72,If I get top surgery through the NHS in the UK is it free,UgxXQxJeyfHMUprn65R4AaABAg,3,0,2021-12-29T00:48:40Z,none
73,"The future transgender males that think 10 inch penis' are perfect and 7 to 8 inches is average needs to lay off the porn. Why do they have such a misguided understanding of penis'? Well naturally because they don't have a penis to begin with, don't have sex with men and only get their info from fantasy/porn and not real life. It's like a teenage boy thinking all boobs should be perky DDD cups while the woman maintains a 26"" waistline and flat stomach.",UgyEFrSoW75Z2FH7bwB4AaABAg,0,1,2021-12-28T16:59:13Z,none
74,Would you recommend medioplasty to another ftm?,UgyDy-DnaWFjaI9Bcmt4AaABAg,0,0,2021-12-26T21:33:53Z,none
75,"Hi, I'm born with a dick, and the only time I stand to pee is at a urinal",UgwzzEsFpkRI8GaedpJ4AaABAg,0,1,2021-12-23T15:44:04Z,none
76,🤢🤮,UgxCcnmF8216eLj1FvN4AaABAg,1,0,2021-12-23T03:19:45Z,none
77,"9:09 ngl I literally sat down to check that because not surprisingly I don't think about them much because mtf trans. About the peeing standing up thing, I guess that makes sense because the only thing I ever do that for is to spend minimum time in the wrong bathroom because closetted.",UgwnzbB2WPM620MuGbt4AaABAg,0,0,2021-12-21T12:44:27Z,none
78,She will always be a female 🤣🤣🤣,UgxwmGhJfsOJvan7uKl4AaABAg,4,0,2021-12-20T23:38:11Z,none
79,Liberals are so dumb,UgyOGWIQcwNhkR05w3x4AaABAg,1,0,2021-12-20T23:37:48Z,none
80,Let’s see that little fella,UgxAsl90AmZTNABdnJV4AaABAg,0,1,2021-12-19T00:51:58Z,none
81,"There are people who think 7 or 8 inches is normal erection size? How much ""adult films"" do they watch?",UgzcZZtXxlb9eEJbQiB4AaABAg,0,2,2021-12-12T21:32:43Z,none
82,First trans man with a beard I’ve ever seen.,UgysqIz8N86DVSwaNfV4AaABAg,0,1,2021-12-10T20:39:22Z,none
83,"highly appreciated, anyway; thankyou
just subscirbed, hope get your reply",UgzB_SNTmcaHYIZRoER4AaABAg,0,1,2021-12-10T09:13:08Z,none
84,Holy heck you look like Tell Me Why character,UgxZ1GDCaq4YGBcV6vp4AaABAg,0,0,2021-12-04T16:13:46Z,none
85,"I know that your video is 2 years old, but I'll go ahead and leave this comment for your thought.

""Like I'd whip out a bottle and pee in it""
As someone with a weak bladder, an empty bottle is the difference between relief and walking into school and everyone knowing that I'd pissed my pants.

""7-8 inches Minimum. 10 PERFECT""
A concept that should be thrown out the window, if you ask me. That is dick shaming at its finest, and honestly the last thing you should be thinking about is dick size when finding a romantic partner. Sex is great but it isn't the end all, be all.",Ugw3Sg3wxfDhHtIIfM94AaABAg,0,1,2021-11-30T05:55:12Z,none
86,"Thank you! As a CIS woman, I must say I’ve seen (wanted or not) 😎more than a dozen male genitalia situations. There is a spectrum, and some looked classic, others - no where near; in some surprising ways. But, never mattered… twas the heart and soul of my companion that sparked my interest- period. Anyway….We love you. ❤️🏳️‍⚧️👏🏾💪🏾🍺",UgwJKW_MsfNN8IAJnX14AaABAg,0,1,2021-11-29T21:48:54Z,none
87,Yahusha loves you,UgxE6FvXs3K86XXJYsF4AaABAg,0,0,2021-11-28T14:56:35Z,none
88,"You cant create a penis. Only biology can do that. Many imposters one original , same goes for the Vagina. It is what it is folks.",Ugym7FqyuXPGNg9KOF54AaABAg,2,0,2021-11-28T13:18:42Z,none
89,Ok wait but how would you pee when you'd healing from surgery?,UgxKaLg3rwdPFVKE4oh4AaABAg,2,0,2021-11-27T23:41:54Z,none
90,''Penis'' I'm sorry that's HILARIOUS I don't even know why!,UgzKvEML66e0ikdFCup4AaABAg,0,0,2021-11-27T19:46:06Z,none
91,Regardless what you chop off you will always be male as women bodies are different  and constructed to bear child. Not all women can but the majority. No male can bear children and trans male are really women. Enough already.,Ugzi-aQZywcuRUpsFkJ4AaABAg,4,0,2021-11-27T01:29:10Z,none
92,Hi jammy Todger,Ugx6m5biJOVSL8N6FVZ4AaABAg,0,0,2021-11-26T12:01:07Z,none
93,Many of the things I wanted to know but wasn't sure if I should ask!,UgxqBvVgr_lVQNvoJj94AaABAg,0,1,2021-11-22T06:47:59Z,none
94,I wish i had bottom surget but like the other way then this person surgery,UgyopsdlvEtDznRHj7t4AaABAg,0,1,2021-11-22T04:57:21Z,none
95,U a cute fella.......luv the channel,Ugyp3jq4Be7x3lz_yJZ4AaABAg,0,0,2021-11-21T14:57:18Z,none
96,"This is so informative, thank you",UgxF-VBLlO6rnyObgrZ4AaABAg,0,1,2021-11-20T21:35:13Z,none
97,Handsome man 😁,UgygQFYRZph7TYibfq54AaABAg,0,0,2021-11-20T10:23:10Z,none
98,"Wonderful informative video, as well as entertaining, it's a thanks from me for sharing your experiences and helping others, your a great guy",UgxNoVBITwJawGrztn14AaABAg,0,0,2021-11-16T20:41:01Z,none
99,I'm a young trans masc and I want phalloplasty but I'm concerned about the sensation,UgzdyAenTPwFV3Vzdeh4AaABAg,0,1,2021-11-11T01:26:55Z,none
100,gross,UgzKss_apFaHfpjD9EF4AaABAg,4,0,2021-11-10T20:11:48Z,none
101,Man ur so lucky,UgyBFtWCgwqxwPkwfPd4AaABAg,0,0,2021-11-06T03:53:10Z,none
102,"Uhm, this isnt that related but after your top surgery did you feel dysphoric when you saw the scars? Coming from a trans person who wants to get the surgery",UgwQCVw3zJc9pmpIblB4AaABAg,1,0,2021-11-01T12:37:49Z,none
103,"Gee, I wonder why you would rather sit down to pee? 🤔",UgzENSXeXOtzjS314KV4AaABAg,1,1,2021-10-29T07:48:24Z,none
104,"""eggcicles.. no"" PAHHSHAH",Ugzio8lAfOvmkjFbgYV4AaABAg,0,0,2021-10-29T07:22:43Z,none
105,Okay so like I know this is really weird but do you have a bulge? Like would you say a packer looks more realistic or no? Again I’m sorry this sounds so weird 😭,UgwxATfMYu4PF1eKyt94AaABAg,0,0,2021-10-27T01:44:10Z,none
106,"As a cis lady, the only reason why I would like to know what it is like to pee standing up is to write your name in the snow with your own pee. 
Otherwise it seems like a novelty.",UgxM7B2az9kqY9elGm54AaABAg,0,2,2021-10-19T10:58:23Z,none
107,"AAAAAIIIIEEEEE!  I'm sorry, but this is just all wrong.  I can't get over the hair.  It's too dark and it's all wrong.  

Loved the rest of video, but the hair is broken.",UgzX40f3Q72oU7DnEg54AaABAg,0,0,2021-10-18T16:33:49Z,none
108,my mom just heard you talking about pënises in the other room and just looked at me lmao,Ugx6WyVVA0DYjsssf2J4AaABAg,0,1,2021-10-15T02:55:06Z,none
