,Comments,Comment ID,Reply Count,Like Count,Updated At,Viewer Rating
1408,Welp. I feel alot better about my penis now. Years of thinking 8in was small...,UgzjRssNfdvaobQnkER4AaABAg,0,0,2019-12-08T12:15:11Z,none
1409,Wait..... Are you telling me you used to be a girl...... ??????? Damn dude... I mean.... is OK?? To call you dude? I guess..  Well you are a dude .... I mean I would never have known you were.... A.... Nahh it Can't be... I need to lay down... Well if it's true... They (and you) did a damn good job.... You look good...,UgwJRVdJdvoqGaOa6yV4AaABAg,0,0,2019-12-08T07:59:14Z,none
1410,You look like cis man. Reakly good looking,UgwSms4zffnYMHDBBLJ4AaABAg,0,0,2019-12-08T04:23:05Z,none
1411,My legs hurt..,Ugwv0PMZxkp45BE-6O14AaABAg,0,0,2019-12-08T04:08:23Z,none
1412,"""That's a lot of penis!"" Omfg I'm dying 😂😂😂😂",UgwKTM_aGnvRAltSZVx4AaABAg,0,0,2019-12-08T03:41:33Z,none
1413,"either you are a man or a woman,  you cannot change your sex....",Ugx0SpEbOTnyed8nWjp4AaABAg,0,0,2019-12-08T03:19:02Z,none
1414,You know you can sit down and pee as a cis guy lol,UgwZo0L2kM7cF98f_314AaABAg,0,1,2019-12-08T02:00:04Z,none
1415,Am I the only one who is picturing what each type look like 😖,UgxyMkcQD5izAeHx_Gt4AaABAg,0,0,2019-12-07T23:40:48Z,none
1416,"the tech age of 2019 is so interesting, to transition and document it online and profit off it. Ive watched a few different people transitioning and not all monetize their sites and sell merch, I'm a free market person so go capitalism and being to able to profit off your journey, I just find it so interesting and dont really have a complete opinion on it yet...not that anyones asking for my opinion, lol.",UgxpZ62YqnetZzS2hvV4AaABAg,0,3,2019-12-07T23:24:53Z,none
1417,🤮🤮🤮🇺🇸,UgwmjSjapMpCpa58QGp4AaABAg,0,0,2019-12-07T21:56:47Z,none
1418,Why trans guys tends to be genuinely really handsome?,Ugx5C_WbEqH32JUymfB4AaABAg,0,8,2019-12-07T21:54:44Z,none
1419,You know what.... thank you. I literally never thought I wanted to know this stuff but I do. And it’s interesting. You hear about m to f all the time but rarely f to m. Thank you for your openness. This was great.,UgzG80tsUZVp0FSS9f94AaABAg,0,3,2019-12-07T21:46:25Z,none
1420,Did he just say “that’s a lot of penis” or did I hear wrong 😂😂😂😭,UgzROnq8H5mfadsqiYN4AaABAg,3,373,2019-12-07T21:22:44Z,none
1421,Im sorry but I need the very personal questions answered. Does the penis work for sex? Do you achieve orgasm? How does cleaning work?,Ugyy0GM5nROTnwguTsJ4AaABAg,0,0,2019-12-07T17:28:30Z,none
1422,I’m i the only person here who was born with a dick and is siting in every position possible just to see if I feel the same as he is describing?😂,UgyHgqgeDK51JNyNdGZ4AaABAg,0,0,2019-12-07T14:09:53Z,none
1423,GOD IS REAL....,UgzUQbnmj2uUOksgdnx4AaABAg,0,0,2019-12-07T06:48:38Z,none
1424,I have a friend who got bottom.   I always was just curious about the details but was too shy to ask cause I dont know him very well.,UgzBVgSpaQLhTwqQgdd4AaABAg,2,14,2019-12-07T06:28:33Z,none
1425,40%,Ugy6bz9hxaFADNXlxYd4AaABAg,0,0,2019-12-07T05:37:20Z,none
1426,💜💜,UgwHJKW_tzK8HXuL-gN4AaABAg,0,0,2019-12-07T04:56:15Z,none
1427,Imitation man,Ugz37wTMw9cJKOGsSxt4AaABAg,0,0,2019-12-07T03:26:13Z,none
1428,Thank you for being so open and candid about such a personal experience/topic,UgwplhzhDJU-AHc3vlB4AaABAg,0,3,2019-12-07T03:20:34Z,none
1429,"The only thing I'm offended by in this video is the butchering of the word ""Urinal""",UgxG4KiV3MR4_0D_Rsd4AaABAg,10,266,2019-12-07T02:34:33Z,none
1430,"thank you for your info.  I know it can be hard to take those steps.  I am fairly sure i am the wrong sex.  but i am old, and poor, so its not gonna happen for me.  I am so glad you were able to get thru it.  I wish you all the happiness life can give you.",UgxIq1tFOOEWh90oDrl4AaABAg,0,0,2019-12-07T02:21:35Z,none
1431,"All im going to say as a cis women i think everyone in general think that bigger is better. No its not. When things are bigger they can hurt thats all im going to say.
Edit: from what i heard this is tru for the back entrance too (i have a lot of very open gay freinds)",UgxUZ9SdDnEf0tjYL4V4AaABAg,1,0,2019-12-07T02:14:47Z,none
1432,My God. The amount of people pandering to this mental illness is incredible. You cannot ever change sex.,Ugzh_nYS9tjA9cYoAkJ4AaABAg,1,0,2019-12-06T23:53:09Z,none
1433,"so is there anything to you besides being transgender? i mean, one would think that after becoming a boy you'd just be a boy, but you seem to be living your whole life as a transgender person rather than a boy. talk about something else, bro.",Ugxyk0Kt4zng18NcVlh4AaABAg,2,0,2019-12-06T23:28:24Z,none
1434,"My fiance's penis is 8 inches & honestly, it hurts me every time we're intimate, especially if we go a couple of days without having sex. Girth matters the most, I think. The walls of the vagina is where most of the pleasure is felt, I believe, anyway. Thank you for this video! It's taught us a lot! Appreciate you❤",UgxLeuHg7Ke8pO8sywB4AaABAg,0,0,2019-12-06T23:17:00Z,none
1435,Thank you for this.  I wanted to share with you that my husband and son are both cis male and pee sitting down so it's not weird.,UgzmkcZ4CCnE7mfAFZl4AaABAg,0,0,2019-12-06T22:37:17Z,none
1436,News Flash! You will never be a man not even close,UgyyTSrMkmnYmXQuimp4AaABAg,1,0,2019-12-06T21:56:06Z,none
1437,Okay but why didn't you get the vibrating and wifi options? Disappointed in you tbh.,UgyPocQii79iKUEt8dV4AaABAg,13,1279,2019-12-06T21:34:54Z,none
1438,"why am i here. i am a cis female. i do not have a trans partner, being ace-aro, and never will.",UgyMZhlmmYNNqGO3giB4AaABAg,0,0,2019-12-06T20:31:08Z,none
1439,Can I just mention that any treatment on the NHS is not free. It's paid for by deductions from a working person's salary.,Ugzl8z3swPAFox0ULO94AaABAg,0,0,2019-12-06T19:56:24Z,none
1440,You look a little bit like Barry Taylor from Sorted.,UgwN-SODXTyf4diYxnF4AaABAg,0,26,2019-12-06T16:10:36Z,none
1441,I have no idea why this was recommended to me but I am grateful because I've learned so much 😚,UgzNCBNPAu_aNWFooGZ4AaABAg,0,27,2019-12-06T16:09:42Z,none
1442,"I need to see the dick... Otherwise, they just don't look real. (but ty for this)",UgzcBni-zDxobVohDst4AaABAg,0,0,2019-12-06T16:05:24Z,none
1443,"From now on they are called tramsgemder people, because the m key on my keyboard identifies as an n key.",UgwI7z35gxn8OvAkQ3B4AaABAg,0,0,2019-12-06T15:02:40Z,none
1444,It's work,UgxCGhFunZFZDtoBLOJ4AaABAg,0,0,2019-12-06T13:07:45Z,none
1445,I don't want to have penis.i want to get taller!!how i wish in this world we have any miracle surgery or treatment that could make some petite people becomes taller.,UgzPIY5pMKVWpKxTW3B4AaABAg,0,0,2019-12-06T10:26:12Z,none
1446,This is obviously very inappropriate for kids but for trans people it can help with future choices in there life's and this doesn't make sense ik ( great vid tho ),UgzOehMPvukHXjryLct4AaABAg,0,0,2019-12-06T08:53:55Z,none
1447,Werk,UgxTpLENqc1ry0KJFBl4AaABAg,0,0,2019-12-06T08:39:16Z,none
1448,Follow up question: are you single? (asking for a friend :P),Ugx_8UKaxYhdWgNhJg54AaABAg,0,1,2019-12-06T05:57:04Z,none
1449,"Thank you for being a role model. Thank you for your honest Q&A, and for showing your decision process on your surgery. I learned so much. Keep being you! I  <3 <3 <3",UgwR3tSWEEV6waLOksh4AaABAg,0,0,2019-12-06T04:41:53Z,none
1450,I have no clue why this was in my recommendations however I’m glad it was. Definitely answered a lot of questions I always had when it comes to bottom surgery for trans men and women.,Ugx0Nyf_lJQVvqSVXFt4AaABAg,0,98,2019-12-06T04:40:00Z,none
1451,God in the US that surgery would cost hundreds of thousands of dollars to maybe in the millions,Ugx6-qmZoBrrlS2-7g54AaABAg,0,0,2019-12-06T03:41:05Z,none
1452,“Monster dick” 😂😂,UgzxtMy0IC1RQI5WSnB4AaABAg,0,0,2019-12-06T03:33:59Z,none
1453,10 inch penis Jesus Christ .,UgwPtvbRs1qZ-cRh9JJ4AaABAg,0,0,2019-12-06T03:32:46Z,none
1454,Why can't we pick the size of our penisssssss😭😭😭,Ugy931G8WsdRsp5pLhV4AaABAg,2,4,2019-12-06T03:09:15Z,none
1455,2:25 that's what I'm thinkinggg why not? not transphobic actually Bisexual and Transgender and wants more info how lower surgery works. I'd like to have it someday.,UgzeplLwxhcEfBKdDzd4AaABAg,0,0,2019-12-06T03:06:48Z,none
1456,So if you were to commit a federal crime would you be in a females  prison or a males prison? 🤔 just curious lol,UgzeFoKZsIEB7Pk9wcZ4AaABAg,0,0,2019-12-06T02:13:27Z,none
1457,I could never tell you were born as a girl but you act very girly.,UgxS7e-AKEvFuU99kkN4AaABAg,0,0,2019-12-05T22:45:37Z,none
1458,Wait you're FTM? Holy crap I watched most of this wondering how you knew so much about all of this and then I read the comments and I was like whoa! That's amazing. You transitioned very well physically!,UgwmCh15urx30jcSfwp4AaABAg,0,2,2019-12-05T21:21:45Z,none
1459,"Do you still have to get regular screenings for cervical cancer? If so, how are they performed if the vaginal opening has been closed?",Ugxes1mfFAbk-fQcl1Z4AaABAg,0,0,2019-12-05T21:20:08Z,none
1460,"let me tell you something? i would never thought that you were another gender physically, that's amazing, you are very beautiful man:3",UgwzUun2aCiFCcrTia54AaABAg,0,1,2019-12-05T20:38:39Z,none
1461,Glad to see Youtube recommending this video to me.,Ugytbf-4_OuneS7gXpd4AaABAg,0,0,2019-12-05T14:59:30Z,none
1462,"Girl you right, it’s way too much responsibility",UgyAizvSVPQVrWM_fxh4AaABAg,2,0,2019-12-05T13:42:31Z,none
1463,you remind me of how to train your dragon guy.... hiccup?,UgyB60K-xbTQwKJ2-HN4AaABAg,0,2,2019-12-05T11:37:31Z,none
1464,"As a brown woman, I am tickled by how many people are befuddled by the fact 7-8 inches is considered average to some people. Even when the question came up immediately after from Jam, I said ""Black people"" & then laughed at some more comments lmao. (average US male is 5.6inches I believe -- & black people only make up like 14% of the population here, so we're generally not the average being spoken of statistically)

I'm here out of curiosity & to be informed. I have in the past thought to/wanted to ask about this kind of thing (out of curiosity) but imagined it's considered rude, as I know it's none of my business, so even with trans friends, I've never seen or asked about this stuff. Like I got an idea based on scientific method models/surgery simulations but never got someone's actual perspective of their own experience with this. Thanks for sharing !",UgwJLs2T1JRmiNSt2uB4AaABAg,0,0,2019-12-05T08:36:08Z,none
1465,Ur-inal,UgzhK6YUu51O9v0P99l4AaABAg,0,0,2019-12-05T08:24:51Z,none
1466,"Thank you  so much for making this video. Its helpful for more than just transexual relationships. So, thank you",Ugzqc8bHGlygSda-2hV4AaABAg,0,0,2019-12-05T06:54:28Z,none
1467,My first thought really was “what kind of surgery are bottoms getting?” I guess you didn’t mean that kind of bottom.....,UgyPNrZu5IlJ6mrr7lh4AaABAg,0,32,2019-12-05T05:31:36Z,none
1468,he acts like a girl who looks like a boy,UgzUAEdW621Iwdxi1q14AaABAg,0,0,2019-12-05T03:16:47Z,none
1469,"First of all- you're freaking brilliant. Second of all- no offense if you're not gay, but you're HOT 😍😍😍",UgxFYUdKylw2UtTeArR4AaABAg,0,0,2019-12-05T01:46:25Z,none
1470,So informative... I didn’t even know I had these questions until someone else asked and you answered.,Ugyg7z1lSmh_Jpt08ol4AaABAg,0,2,2019-12-05T01:01:30Z,none
1471,I think it's funny how big the Packers are when I see them at trans health conferences. I showered with guys my whole life and I've never seen junk that big. Lol.,Ugz8CsRr0dLCDEn9_394AaABAg,0,0,2019-12-05T00:38:24Z,none
1472,"Men don't say ""I had to run downstairs and change my ""top""."" They say ""shirt"" or if their really macho "" fucking shirt"".",UgwdR3MAEbHVC7-yzOZ4AaABAg,0,0,2019-12-04T23:54:48Z,none
1473,It's called a Phalloplasty :),Ugz3m8duPB2kkPwdrWV4AaABAg,0,0,2019-12-04T23:20:03Z,none
1474,Are you attracted to men and women? And what happens to your period? Do they remove all your female parts inside? Thank you for sharing such personal parts of your life,Ugzc5eJskLQHMqGsLV94AaABAg,0,0,2019-12-04T22:56:18Z,none
1475,Nigel but your voice sounds like a man who consumed some helium gas I'm so sorry no offense,Ugwqn61SRlIig__V1qd4AaABAg,0,0,2019-12-04T20:02:23Z,none
1476,Up until now i thought bottom surgery meant bum implants,Ugw-NU8xFZwPMJUhO8t4AaABAg,0,0,2019-12-04T19:25:30Z,none
1477,I’m here cause my boyfriend is ftm and I’m mtf my bestie said that sounds like being straight with extra steps 😂,UgwPuo9_RQvXhfr8yiJ4AaABAg,272,20538,2019-12-04T18:00:00Z,none
1478,"I’m a Cis Male, and I sit down too so I can watch TikTok 😂",UgxOUCh1x6jaiKlP8Il4AaABAg,0,53,2019-12-04T17:46:19Z,none
1479,You look amazing!,UgyzZNYfGlMsSHo1Kqx4AaABAg,0,0,2019-12-04T17:46:00Z,none
1480,"Hmmm, interesting. I’m a guy, not trans, but I’ve got a friend that’s FTM and this basically answers the questions I wasn’t comfortable asking haha. I never even thought about balls until this video wow",UgxbVaNvBEoRr2f7Ez94AaABAg,0,6,2019-12-04T16:09:28Z,none
1481,Why I always enjoy talking about penises good sir.,UgxsPkqLwo6wRJV3Q7B4AaABAg,0,0,2019-12-04T14:35:12Z,none
1482,I don't know how I got to this place on the internet but I'm glad I did. I love learning 🙌.,Ugx9uygb0e-F7oHpvap4AaABAg,0,4,2019-12-04T14:11:03Z,none
1483,"Wow, you just pop on the recommended, I always have those doubts so thank you very much! I'll watch all your videos, you are the only FTM who I felt  okay with, I have MTF friends, but the other way around was difficult to watch, may I ask about the skin ""problem"" because the majority take a huge chunk of skin from the arm and it's not pretty, I never understood that, sorry if it was offensive",UgzYTs_uEMXlEuf0mx14AaABAg,0,1,2019-12-04T06:33:51Z,none
1484,It’s amazing what doctors/surgeons can do nowadays.,UgxKHO8dqpjgxYru9Fx4AaABAg,0,0,2019-12-04T05:39:11Z,none
1485,my question is are you more logical than emotional now?,UgxamuD8GkhxOG0TOSR4AaABAg,1,0,2019-12-04T05:37:38Z,none
1486,"Sooo, my first thoughts were actually how awesome it would be from a grooming standpoint.  Lol. No more waxing, no periods, less body shaving?? (Legs) I imagine that would be very freeing! (In addition to the more important things listed in the video) God bless you for living your best life! ❤",Ugx4o9q5pKjgIRofeUF4AaABAg,0,4,2019-12-04T04:26:20Z,none
1487,I never would have guessed u was ever a woman at one time. U look like an actual guy. Great job,Ugw3-UrL9aW4oTLCi6B4AaABAg,0,0,2019-12-04T03:51:05Z,none
1488,"do you see how manspreading can happen due to having something in between your legs or is that 100% a jackass ""masculine"" issue",Ugzkq_2saj006ahN7BR4AaABAg,0,0,2019-12-04T03:18:24Z,none
1489,What is sis or cys? I dont know the lingo.,Ugwi6QFDUVcD3Mu1a2B4AaABAg,1,0,2019-12-04T02:35:21Z,none
1490,Do you still have your period,Ugz3bPGDJku13QkBAvx4AaABAg,0,0,2019-12-04T00:30:44Z,none
1491,"Omgg I saw you at buzzfeed, loved your story! Hope you’re doing well",UgxWLFBUttLWsrcyjNZ4AaABAg,0,0,2019-12-03T23:27:34Z,none
1492,So you are man spreading now?,UgyEhI24dmeQW7pNCO54AaABAg,0,0,2019-12-03T23:17:12Z,none
1493,"I have a question, I’m sorry if it’s disrespectful. What kind of doctor do you see for you bottom parts? Like you used to see a gynecologist, do you see a urologist now? And if a trans women had bottom surgery does she then see a gynecologist? Here is why I ask, Jessica Yaniv ( and trans women who has not had bottom surgery) is mad that a gynecologist refused to treat her. What do you think?",UgzUClMyLHbLK7zRKot4AaABAg,1,0,2019-12-03T20:50:50Z,none
1494,I am genderfluid so doing surgery wouldn't really do much for me since I go back and forth with how I am feeling that day though for the most part I feel more like a male then a female even though I am technically a female at least physically. Guess I'll just keep wearing binders and dude clothes lol..,UgyYH29VkLeIR-kw2dx4AaABAg,0,3,2019-12-03T19:59:18Z,none
1495,"I clicked on your video, I don't really know why since I had no idea of what meant FTM bottom surgery. For the first few seconds, I thought you were going to talk about penis enlargement surgery and I thought : damn, cute guy is super open and has no shame talking about this complicated topic... Then I actually understood and was like: 1) Damn!! NOT what I was expecting 2) THANK YOU!!!I just LOVE the fact that you could answer my questions about balls because you can compare between having and not having them haha",UgyVW6_-L-gaZOA9t4F4AaABAg,0,0,2019-12-03T18:26:02Z,none
1496,You are gorgeous and so kind.  So many thanks for your openness. <3,UgzfUBXYHStiUlshXr54AaABAg,0,0,2019-12-03T10:33:06Z,none
1497,"Holy crap. The last time I’ve ever seen or heard about you, you were just starting out the transition. Here I am, however long ago that was and I’m watching this.",Ugz8UJZShDdswYJY_eR4AaABAg,0,4,2019-12-03T09:45:04Z,none
1498,Is there anything like the NHS in America that helps with cost of trans surgeries?,UgzEeGUS4qCUFxeLVyh4AaABAg,1,0,2019-12-03T06:14:53Z,none
1499,You are a sick pervert,UgxupwFQltrhrSKmoEB4AaABAg,1,0,2019-12-03T05:40:28Z,none
1500,"Appreciate 1st person perspective , appropriate terms, without the “ick’ factor or embarrassment..........educational and honest answers .........matter of fact......no politics .......truly appreciated and nothing but respect .............as bio female ...I do not understand .....but aspire to ......",UgwhLOSaGq60p0N0Le94AaABAg,4,15,2019-12-03T04:54:55Z,none
1501,"And now because of the season, you can get regular or pumpkin spice",UgwlG-sKLc0SqMKwvP14AaABAg,0,0,2019-12-03T04:12:45Z,none
1502,"7in too much responsibility - D E A D lol!  As a lesbian with several different sized dildos, I can confirm",UgwPwxptW3clZSju5iV4AaABAg,1,1,2019-12-03T01:38:06Z,none
1503,I don’t give a rat’s arse what his tackle looks like - he’s cute and a good lad and that’s enough for me! I do appreciate him answering questions that we all wanted to ask but were too scared to.,UgyWh2gNKvD7K-Xq33F4AaABAg,2,903,2019-12-03T00:01:04Z,none
1504,"German men - whether gay, straight, bi or whatever - sit down to pee! It’s considered normal here. IMO, pee in whatever way you find comfortable. But if you sprinkle on the floor, wipe it up...!!",Ugy32RLHEVCepVyNxLR4AaABAg,1,4,2019-12-02T23:59:18Z,none
1505,"I have no idea why this popped up on my suggested... but I just wanna point out, I never would have guessed in a million years that you were trans.",UgziRhTl8ean0RizE3B4AaABAg,0,1,2019-12-02T18:32:49Z,none
1506,As a male born person ....  How can a trans person grow a fucking beard and I can't even grow facial hair wtf.   I exercise I'm shredded and still nothing wtf I'm going to shoot up testosterone up my fucking veins 😤😤,UgxhpzB-yGYePcAIr7d4AaABAg,0,0,2019-12-02T10:53:36Z,none
1507,I love how chill and open you are to answering questions. You’re serving a greater good of educating anyone who isn’t trans and anyone who is and has questions. I bet Little Jaime would have bee very grateful for your content,Ugy6O3spJFyhsY4LTkB4AaABAg,0,9,2019-12-02T07:00:30Z,none
1508,"Sounds like you've got the full good experience of balls, without the gut clenching horror of being kicked there. So, here's a weird thing many balls-owners do: stand with your legs slightly spread, and bounce them between your thighs for absolutely no reason whatsoever. Have you tried this yet?",UgzKU1Ci1Qc9mxTciMt4AaABAg,0,0,2019-12-02T05:16:48Z,none
1509,You're cool,Ugzqd7RjEyvUbWaZ76t4AaABAg,0,0,2019-12-01T16:12:53Z,none
1510,My Ques is unanswered 😡,Ugz-zncl9CUoG_6Zt994AaABAg,0,0,2019-11-30T23:30:14Z,none
1511,I heard the🍆look horrible. thats why im here. I curious to know,Ugymd8xlqPSH5TN-fZB4AaABAg,0,6,2019-11-30T22:57:20Z,none
1512,Terrible,Ugx5w06mrnOgWKA5xXZ4AaABAg,0,0,2019-11-30T16:43:07Z,none
1513,So handsome,UgyEzQmz2MdajE3UTeR4AaABAg,0,0,2019-11-30T13:30:58Z,none
1514,"You are amazing... thank you for sharing. I'm a cis gay man, and I have learned a lot just from this one video ( I've subscribed so I'll be watching more) I am glad you are in a place where you are clearly comfortable and happy in who you are. I think it's incredibly powerful that you are willing to help educate people both cis and trans about your journey so far. Thank you",UgzOXyiv8RMyTWrKQAJ4AaABAg,1,2,2019-11-30T07:47:01Z,none
1515,So I’ve come to a conclusion... YouTube puts random videos that don’t portray to anything that I usually watch into my recommended and then I watch those and I end up with more random videos. It’s a cycle that never ends.,UgwuE1r8oMROC5KbhIV4AaABAg,1,10,2019-11-30T06:55:44Z,none
1516,You’re the best!,Ugz3-yXWwOpPxenq__d4AaABAg,0,0,2019-11-30T02:25:23Z,none
1517,Why do I feel like I saw you on BuzzFeed?,Ugzw6MPHWkNQVyHhW7R4AaABAg,1,1,2019-11-29T22:42:49Z,none
1518,i’m so happy the weight of transitioning is off your shoulders i wish my government would allocate money for these surgeries so more people can feel like that.,UgyYH7ubvmM9FSA3iJF4AaABAg,0,11,2019-11-29T15:36:16Z,none
1519,Hi. I've come across this channel by accident as my side menu suggested it might be something I'd find interesting. I do. I can also say that I am a straight female and you are a very attractive man. I wish you the best for the future x,UgxX8ALyCr6Q1ImmQER4AaABAg,0,0,2019-11-29T15:09:58Z,none
1520,between 5-6 inch's erect is average  and 2-4 inchs flaccid is average...XD,Ugxpo6iO9tfWJIKXGdt4AaABAg,4,7,2019-11-29T07:00:36Z,none
1521,"you’re so, so, so handsome 😩",UgxLwoJkDw-8O0BcZX94AaABAg,0,7,2019-11-29T04:09:28Z,none
1522,Omgggg the ball questions killed meeee 🤣🤣🤣,UgyPrYfTPxRQ_D2ePKh4AaABAg,0,0,2019-11-28T03:44:15Z,none
1523,everyother word is penis LOL,UgxUuRd0RGYc4JRZ_zN4AaABAg,0,0,2019-11-27T23:14:11Z,none
1524,Too much responsibility 😂😂 that killed me 😂🤦🏻‍♀️,UgwuBo1MJfAROPcnfIN4AaABAg,0,6,2019-11-27T21:00:33Z,none
1525,Bull enjoy,UgxDJT5pzGxmgi4MDP14AaABAg,0,0,2019-11-27T20:07:03Z,none
1526,All dumb question s God gave what gave you down there just leave it there! Top surgery is ok but to have something so complicated down there come on all crap!,UgxGWn2apH06OIGj5JV4AaABAg,0,0,2019-11-27T20:06:12Z,none
1527,Oh God you are so handsome. How ?😊,Ugzm_UvqM7tpi72uO-d4AaABAg,0,0,2019-11-27T16:50:55Z,none
1528,I think we are all just curious.  And I would never know you were trans. It worked very well,UgwdOEIGmseAb3e_xpN4AaABAg,0,0,2019-11-27T06:42:27Z,none
1529,Omg I’m glad I watched this as it was actually really educational as I only knew of one type of fml to m surgery which was with the erectile pump thing. Also it makes complete sense but I just never assumed there was 2 stages,Ugzge-bwgHKzP5luhX14AaABAg,0,1,2019-11-26T21:43:26Z,none
1530,I'm a cis lesbian. why am I here you may ask? because I have trans friends and I want to be educated,Ugw7ewNquYJNRP6BR5N4AaABAg,0,2,2019-11-26T19:30:32Z,none
1531,This video was PAINFUL ...to watch,UgzEQ6Cwx1FFWRyQ_OB4AaABAg,0,1,2019-11-26T16:46:33Z,none
1532,You didn’t pay ? The UK is officially screwed if they’re paying for this. You’re going to regret this in years,UgxJTpFvD5XH85z68O94AaABAg,0,0,2019-11-25T15:02:33Z,none
1533,Thank you for educating:),UgyXQBANHO7bpB1bRAt4AaABAg,0,0,2019-11-25T08:05:15Z,none
1534,🤮🤮🤮🤮🤮🤮,UgzUwJ5uBJ_z-V4hqqx4AaABAg,1,0,2019-11-24T05:50:59Z,none
1535,One term i dont understand is ---What is a CIS guy ?,Ugxtsp2Mbc1lyqYeUpZ4AaABAg,1,0,2019-11-23T04:08:30Z,none
1536,your hands are the only feature which give you away,UgwZFJ6vXGGy930w8eF4AaABAg,0,0,2019-11-23T03:59:35Z,none
1537,"this was awesome but I gotta say..... 7-8 inches minimum IS normal, imho. at least for me lol now i'm just super self-conscious that i'm like some size queen a-hole.  but i've always kinda been like ""ya gotta be at least 7 in to ride this ride"" lmaooooo but this video actually challenged that and ima try and be less of a dick about size(pun very much intended). Thanks for sharing and teaching and being dope.",Ugxu97aErYTvD_iTJON4AaABAg,0,0,2019-11-22T23:29:52Z,none
1538,"I freaking love your honesty and your bluntness and I’m a huge shipper for you and Shaaba. Just... thank you for putting your truth out into the world, and helping others who may need your encouragement and advice. You make the world a better place.",Ugyd9ons5JPcDTk6tFd4AaABAg,1,6,2019-11-22T22:09:51Z,none
1539,I didn’t know you could that through nhs. So happy about it. It’s the first time I will be happy to pay taxes.,Ugy9PuSImn-ahHQFOOd4AaABAg,0,0,2019-11-22T12:31:19Z,none
1540,"Sounds very much like cis balls to me, and I'm a cis guy.",UgzyWXSP70lWwc-as0F4AaABAg,0,1,2019-11-22T08:48:09Z,none
1541,"Maybe this this a dumb question, but do they get the skin for the new peen from the previous existing labia?",UgzWvdmhz-m0WllXnzl4AaABAg,0,0,2019-11-22T05:05:45Z,none
1542,Have you use it for intercourse? And does your partner felt any difference from the real one? Satisfaction or climax wise? Any discharge?,UgxY7Sdqp3bQJFYy2Vp4AaABAg,0,3,2019-11-22T01:00:37Z,none
1543,Very interesting. But if a trants FTM likes guys does that make them straight?,UgxO8HdbuEIP0uY87WV4AaABAg,1,0,2019-11-21T15:42:05Z,none
1544,5 inches sounds fine. 10 inches is caricature.,UgyEn92JWReTRR985nd4AaABAg,0,3,2019-11-21T10:12:19Z,none
1545,What does ftm means??,Ugx3FJ-bX87lR42SI6J4AaABAg,1,0,2019-11-19T22:49:09Z,none
1546,"Fun fact, I tried googling metoidioplasty and most of the actually relevant pictures were of you. Not exactly what I was looking for.",UgxMBM871_6qguBdJ354AaABAg,0,1,2019-11-19T18:44:31Z,none
1547,"wonder why this vid pops up in my feed... :P you're really handsome I have to say :) oh wow, and seem to be famous on youtube!",UgxW-KE232FexHTcU3t4AaABAg,0,2,2019-11-19T18:03:08Z,none
