,Comments,Comment ID,Reply Count,Like Count,Updated At,Viewer Rating
212,👏🏻👏🏻 thank you so much for creating this and making it a series ! I feel it can help so many people,Ugy91GMXa86ZQUEgueR4AaABAg,0,0,2017-08-02T05:25:03Z,none
213,"Just looked and all but 4 of his videos are gone on restricted mode, even this one is gone.",UgzXtcAxE86aejzkeLx4AaABAg,0,0,2017-08-02T04:44:37Z,none
214,Chase you are awesome!,UgySwDNLvrap2seGH9Z4AaABAg,0,0,2017-08-02T03:38:51Z,none
215,"I have a serious question: is it respectful or OK to ask someone you meet what there pronouns are? What if they are trying to ""pass"" and then I ask them that, and they feel like shit because now they think they arnt ""passing""? I want to be respectful both w/ the right pronouns and with just being a decent human being in general.",UgwZhU92X-TTJAUNmAJ4AaABAg,4,0,2017-08-02T02:49:12Z,none
216,"Chase I love you so much! Ty for making this video. I am sis and I have been watching u for little while now. I just have so much respect for you. I thought I knew but now I really know. I am so open AND LOVE how it doesn't matter what gender, color, etc just DO YOU! Have fun and do what makes u happy! I just love u as a human and love ur videos.",UgwiaR5IwlVF90hm59N4AaABAg,0,1,2017-08-02T02:42:51Z,none
217,"As a cis, the best way that one of my friend (who is trans) explained it to me was: Imagine that you woke up the next morning with ""male genitals"" (if you're a cis woman) or ""female genitals"" (if you're a cis man). You look in the mirror and the body that you see doesn't match who you are. Now imagine that you went to the store and the cashier said, ""thank you ma'am"" or ""thank you sir"" and you knew they were wrong but nobody else saw you the way that you felt. And you had to navigate through life with people assuming you were something that you weren't. Essentially, if you woke up looking like a female then you wouldn't suddenly identify as a woman; you'd still be the same person. Now I've educated myself more on the subject and know that there's a lot more to it then that and that I will never completely understand but it was a breakthrough for me when it came to beginning to understand more.",UgxK4n8EEBHrAkeSUpJ4AaABAg,0,0,2017-08-02T02:27:30Z,none
218,This was so f u c k i n g  beaaauuu thank you so much for making this,UgyBDhrOV8_zoiYAEz54AaABAg,0,0,2017-08-02T02:14:51Z,none
219,GURL 10/10 this was the best part of my birthday ngl,Ugx7rK8_AKd08OPISm54AaABAg,0,0,2017-08-02T02:02:44Z,none
220,Shit you have so many secret project. When is the thing with Ty and Sophie coming?,UgyprgAeuxi2NT88v0J4AaABAg,0,0,2017-08-02T01:59:43Z,none
221,A perfect gift for a somewhat stressful month. Thank you Chase (: Your videos are such a safe haven for so many people.,UgyAaf29xJR0sAZHAFh4AaABAg,0,0,2017-08-02T01:48:46Z,none
222,All but the first video on the playlist are private?,UgySW__bUo76_703txB4AaABAg,1,0,2017-08-02T01:43:13Z,none
223,"I hope you will be careful covering the dysphoria section. I deal with a lot of kids who have confused feelings and don't know that it is dysphoria but they know for sure they are trans already - get told they are not trans ""because they don't experience dysphoria"". I know we all do but even I didn't recognize my own dysphoria when I was younger.
Just a word of caution. <3 Thank you so much for making these!",Ugz5o9zeZZmR9QsrEEJ4AaABAg,0,1,2017-08-02T01:05:47Z,none
224,"I hope that this series will educate some trans people who attack other trans people who chose to not medically transition, like me :) 
Love you 😽",UgyvADXSy73CBvNUihZ4AaABAg,0,0,2017-08-02T01:04:29Z,none
225,OMG PLEASE MAKE A VIDEO ABOUT NONBINARY TRANS PEOPLE MY NEW FAMILY IN LAW DOES NOT UNDERSTAND ME,Ughge3s7Diw8NXgCoAEC,0,0,2017-08-02T00:54:47Z,none
226,"Hey, do you need someone to talk about being nonbinary and not having a lot of body dysphoria?? Just as an example of an ""unusual"" or ""not typical"" trans experience?",UgzLz1Rgmwp_p0TP_e94AaABAg,0,0,2017-08-02T00:51:04Z,none
227,"this was a perfect time to post this because i need to come out to my mom soon and i wanted to show her a video, but there's not many out there that's good enough and informative enough.
this one is perfect, thank you Chase!!",Ugw9iKvqmPSpZSI6hqR4AaABAg,0,0,2017-08-02T00:46:08Z,none
228,"Great job with this series!! Kudos are definitely due!  On a side note, your hair color really make your eyes pop!",Ugym1R0H_SiwjbZH-xF4AaABAg,0,0,2017-08-02T00:39:46Z,none
229,"This is something I try and tell people. That as a cis person we cannot actually 100% understand how someone that's trans feels, but we can try and mentally grasp the concepts that they are trying to share with us, and believe that what they tell us about how they feel is true. It's amazing how people won't even educate themselves on the basics so that they can make informed decisions when it comes to things like voting, healthcare, etc for people. Discounting your experiences in your life because they don't want to try understand where you're coming from, is wrong. Flat out. I'm so excited for the rest of this series and the 201 one as well. I've always tried to be as educated as possible on various things, especially when it will help me be a better ally to others within the LGBT+ community. SOrry this is rambly and if it doesn't make sense. I'm a bit tired tonight.",Ugyq-dhlvys3MTdgK5d4AaABAg,0,0,2017-08-02T00:37:50Z,none
230,"Chase, that end bit where you talked about who you are as a person besides being trans warmed my heart. Thank you for not only educating people on trans issues but also humanizing them. It's so wonderful for young and newly questioning trans people to know they can also have a future with success and meaningful relationships.",Ugw1fkxeR2KCYPr6WmF4AaABAg,0,0,2017-08-02T00:28:33Z,none
231,Are you still doing the giveaway?,UgxxO3ifvnYZU40vm7J4AaABAg,2,0,2017-08-01T23:40:17Z,none
232,Chase I loved you before but now I love you even more! As a transguy I've been trying to find stuff to help educate my mother! This series will definitely help a lot thank you Chase!,UgxWpd0aUDmGMnX0vEp4AaABAg,0,0,2017-08-01T23:34:17Z,none
233,Im pretty sure im a trans guy (or at least non binary) but ive not fully come out to myself a trans and i want to take steps to see if it fits but i dont want to tell my parents incase im just non binary.. i really want a binder but im terrified of getting one 😞,Ugz6jF8iEQy0Jqu3ZQN4AaABAg,0,0,2017-08-01T23:20:18Z,none
234,This is great. I like this.,UgzB2yRtQclsfB_nBY54AaABAg,0,0,2017-08-01T23:16:56Z,none
235,"THANK YOU SO MUCH CHASE!!!
I cannot wait for the topic of top surgery!!",Ugzw5x0U8r1KrFyc4qZ4AaABAg,0,0,2017-08-01T23:07:44Z,none
236,"My bf is trans and I watch videos like this to better understand him. Thanks for keeping me educated, you're an amazing person",UgwwVE8u8-CKpazmua14AaABAg,0,1,2017-08-01T22:46:40Z,none
237,"when saying who the video was for you forgot to say
ALL THE LIMES THAT KNOW ALL OF THIS SHIT BUT GOTTA WATCH EVERYYYY VID",Ugy6sOqZcaymmtZkd5Z4AaABAg,0,0,2017-08-01T22:35:19Z,none
238,I'm in love with you.....gosh so hot,UgyNTNt3PwjsugHu3e54AaABAg,0,0,2017-08-01T22:31:28Z,none
239,Defiantly showing my parents this,UgynbKNdAIizuLqRbBB4AaABAg,0,0,2017-08-01T22:24:34Z,none
240,go Chase!,UgzIsHt7tn2w9mKKted4AaABAg,0,0,2017-08-01T22:13:57Z,none
241,this is amazing! it looked so professional. i'm pretty sure some close-minded people might change their minds a little bit and start being more respectful.,UgwdqLtSqlCN85trRtt4AaABAg,0,0,2017-08-01T22:05:03Z,none
242,"Chase you are amazing ^^
I've been struggling really hard with my gender for quite a while now (and still not sure what I am) but I love your videos and I really like this series! Thx for making them and keep up the amazing work!",UgwGJF2xbEVF9ixtFWF4AaABAg,0,0,2017-08-01T22:04:40Z,none
243,GOD BLESS. I CAN SEND THIS TO MY FAMILY,UgzVu4HT2HHKynCIwtl4AaABAg,0,0,2017-08-01T21:51:08Z,none
244,Nice! I'm really excited for these videos :),UgzM1hLcnW7SmmDm0Zh4AaABAg,0,0,2017-08-01T21:41:39Z,none
245,YES YES YES,UgzowaHCzD7nRC5__H94AaABAg,0,0,2017-08-01T21:40:35Z,none
246,Great video! I'm so excited for this series! <3,UgyTQZnNkdndjl5uXlZ4AaABAg,0,0,2017-08-01T21:32:11Z,none
247,Guess who's sending this to all the people they've come out to thus far. Honestly this is so great and I can't wait for the nb part(s?)!,UgyUc8iH2zBLJWR01614AaABAg,0,0,2017-08-01T21:26:32Z,none
248,Are you going to talk about mtf people or just ftm? Btw I love your channel XD,Ugytkd4sd3wsXQOW-E14AaABAg,1,1,2017-08-01T21:23:03Z,none
249,Does anyone know how to share this on my social media?,Ugz_fyZ-tvqDfPHlit54AaABAg,4,0,2017-08-01T21:20:41Z,none
250,Can't wait til we level up and get to trans 201 ahah,UgzHsyw51LYzX8w7lWB4AaABAg,0,0,2017-08-01T21:18:57Z,none
251,YASSSSS CHASE EDUCATE US REGULARLY YASSSS! (btw you sound so professional),Ugx6a_ippJKjmRD945N4AaABAg,0,0,2017-08-01T21:08:08Z,none
252,❤️❤️❤️❤️❤️,Ugy8uOusL_WbLo9HSCN4AaABAg,0,0,2017-08-01T21:07:03Z,none
253,"Some criticism: I agree with your general ideas but there are a few scenes I disagree with, or rather, would have worded differently. For example, the use of ""feel"", ""identify"", ""percieve"", ""gender identity"" and ""gender"". It's best not to use the words identify and feel because we don't identify or feel a gender. The only way you can feel male or female is the roles assigned, however we can generally ""feel"" that our sex is wrong, which is actually just dysphoria. I think it's best to not use the words gender or gender identity either  because they both refer to the social and cultural roles assigned to men and women, gender identity being which role you identify with the most and how you express that. As trans people, we know that this is not the case for us but we have been lead to believe that gender and gender identity is when our outside doesn't match the inside. However this description is inaccurate as gender has never referred to this, it's always referred to the social aspect. It would be much better to state that our sex does not match with who we are inside, hence dysphoria rather than our ""gender"". As you stated, this has nothing to do with gender non-conformity and by using the term gender, it just reinforces the idea that if you do not conform to your gender role, you are trans.",Ugx0RP4f7wMslAYBNwt4AaABAg,0,0,2017-08-01T22:27:10Z,none
254,hey chase! im a minor and i identify as a male! im 14 and ftm trans! and i have a lot of questions for my future. i get horrible dysphoria and i hope to have top and bottom surgery in the future and i was wondering if youd also mention the cost of surgeries in the surgery video? thank you so much,UgzqH4YRjE2FnaDsfIF4AaABAg,0,0,2017-08-01T20:46:12Z,none
255,The 201 stuff should hopefully be helpful. Gender is a concept that still doesn't make sense to me. I'd likely be considered agender and at this point by every definition I've heard I don't understand what the value in the term is.,Ugzj0yH4ZXHdFTLgiEp4AaABAg,0,0,2017-08-01T20:40:26Z,none
256,"Chase, this is brilliant. I will be coming out to a lot of people this next year after I move out, and I needed this so badly. I admire the amount of work that has gone into this (a new one every day for the entire month! That is amazing!), and I just want you to know these videos do help so many people. Not only this series, but the videos you do specifically for transgender people themselves. Thank you.",UgyVGQmVWHhw3vKDVYt4AaABAg,0,0,2017-08-01T20:37:45Z,none
257,I'm so excited for the rest of this series. Thank you chase. I think when and if I come out to the rest of my family I'll link them this playlist.,UgyaQAr085dN1GqdzhJ4AaABAg,0,0,2017-08-01T20:37:33Z,none
258,I've been dealing with a lot of hate today and this kind of healed and validated me Thank you,UgwhCg5K-lblDw028Gl4AaABAg,0,0,2017-08-01T20:16:03Z,none
259,"Also, my boyfriend (who looks almost exactly like you) is still really resistant to understanding trans people. I've never expressed my feelings about my own gender identity to him and its been a point of contention between us for a while. I can't wait to watch these videos with him. I think it will really help. Thank you 💖",UgyGdoZziLJ_GafHV2V4AaABAg,0,0,2017-08-01T20:15:17Z,none
260,Tysm for everything Chase,UgyqrNU1ZgHWs8RLtSZ4AaABAg,0,0,2017-08-01T20:11:42Z,none
261,Thank you for helping me becoming a better ally and also your blue hair is awesome,Ugyt6Tsff6BNJ4j3KUp4AaABAg,0,0,2017-08-01T20:07:30Z,none
262,Ugh I wish you were my best friend. Your presence is so comforting.,UgzJPMF8hU2LUcNSPTZ4AaABAg,0,0,2017-08-01T20:03:47Z,none
263,For some reason I thought the title was What is a transgender,UgiM08BbRcqlFXgCoAEC,0,0,2017-08-01T19:50:28Z,none
264,Are nonbinary people going to be covered in this video series???,Ugjp4CmIuhJZkngCoAEC,0,0,2017-08-01T19:48:34Z,none
265,I love 101 stuff. You look so professional Mr. Bee. In the gender dysphoria video make sure to say not all trans people experience dysphoria. Love you papito (I'm a native Spanish speaker and I love to call you papito in a horny way lol) <3,UgyIjtBM4VclAeLCI494AaABAg,0,0,2017-08-01T19:47:32Z,none
266,Thankyou so much.. I'm going to share every episode with my family so they can understand better,UgjTda2e3dRkfXgCoAEC,0,0,2017-08-01T19:43:54Z,none
267,"This is such an amazing series idea, Chase! I recently came out to my mom, she accepts me but doesn't really understand it so I really appreciate a series like this - especially done by my favourite Youtuber, haha.",Ugh9NwJBjSJroXgCoAEC,0,0,2017-08-01T19:43:10Z,none
268,"Ohhhh my god this is so well timed. My parents don't really know much about trans people, I think, and it's a big obstacle for them in accepting me, but I'm trying to get access to hormones and I need them to understand. I'm really hoping that if I send them some of these, it'll help.",Ugjczf9eilHlqngCoAEC,0,0,2017-08-01T19:42:26Z,none
269,"This is such a good thing
i hope it is going to educate a lot of people and help them understand the trans community more.
Keep doing what you're doing papito <3",Ughn2BklTS22V3gCoAEC,0,0,2017-08-01T19:21:12Z,none
270,"Oh my gosh, thank you soo muuch Chase!!!!!!!! I want to show my mom this video, I hope I'll be brave enough to show it to her😂",UgiFGO8EWN91KXgCoAEC,0,0,2017-08-01T19:19:04Z,none
271,"this conversation:
friend:  oh your dogs so cute whats his name ?
me:  well actually her name is lily !
friend: oh I'm sorry *pets dog* well aren't you a good girl !

people apologise instantly for misgendering your dog .... but you can't do the same for a fellow human ?",UgjSfFmZ0Ihx23gCoAEC,11,169,2017-08-01T19:10:53Z,none
272,This playlist will be so helpful to my dad and my grandma!  Thank you!!,UghNqrrbgm87bngCoAEC,0,0,2017-08-01T19:10:36Z,none
273,"im so pumped for this because i get to share it with  my family and friend and educate them if they're curious. im cis so i dont know what it's like to be trans, but as someone who is bi/pan/queer, the lgbt community means a lot to me. i cant wait to share this on social media, especially with what's going on politically. love you chase <3",UggD90mLMw4TLHgCoAEC,0,0,2017-08-01T19:08:55Z,none
274,im here caus ur my dad,UghZ1nA67d8qUngCoAEC,0,0,2017-08-01T19:06:15Z,none
275,"great video chase! loved it, can't wait for the second one!

ps: your teeth are so white HOW",UgjscgrOJqtyL3gCoAEC,0,0,2017-08-01T19:03:31Z,none
276,HOLY SHIIITTTTT PAPY,UghCWwRFM0u3wngCoAEC,0,0,2017-08-01T18:58:46Z,none
277,This is such a good introduction to the trans community! Good job dad :D,UgiABqTdRJRAsngCoAEC,0,0,2017-08-01T18:56:02Z,none
278,explaining what its like to be trans to a cis person is like trying to explain the color red to someone who is colorblind,UgiwjTSM-EUi63gCoAEC,0,0,2017-08-01T18:53:07Z,none
279,YESSS!!!! MERCI!! I'VE BEEN HOPING FOR A SERIES LIKE THIS! MA MÈRE A BESOIN DE CETTE SÉRIE!!! * READY TO DO FRENCH CCs *,UgyI_ivwm5tBhTaD1JN4AaABAg,0,0,2017-08-01T18:43:42Z,none
280,Thank you for this series.I've had a hard time with my family not believing what I say and doubting me on other issues so I'm terrified to come out but these videos will help me to try to educate them when I feel ready.,Ugw4Tj5ZliXclt-7lj94AaABAg,0,0,2017-08-01T18:41:40Z,none
281,my boyfriend will most likely be sending this entire playlist to his unsupportive mother. wish us luck in gaining her understanding and support.,Ugi2OgWgJRwXl3gCoAEC,2,147,2017-08-01T18:38:59Z,none
282,EVERYONE NEEDS TO WATCH THIS SERIES!!!,UgjBcTYVDwanfngCoAEC,0,0,2017-08-01T18:38:32Z,none
283,I love the seriousness! Get that world educated!,Ugja32hHzyUM9XgCoAEC,0,0,2017-08-01T18:36:11Z,none
284,"THANK YOU FOR DOING THIS, I WAS LITERALLY JUST SAYING LIKE LAST WEEK THAT I WISH SOMEONE WOULD MAKE A VIDEO SERIES LIKE THIS",UggqXHlKo_Y0R3gCoAEC,0,0,2017-08-01T18:29:57Z,none
285,I'm non binary but really want top surgery. I never felt it was possible because I'm not transgender. so does getting top surgery make me trans? I don't want to claim something that people fight for everyday. this has been my battle since middle school. I only recently discovered the term non binary and what it means and identify strongly with that cause my whole life I felt uncomfortable in my body but didn't identify with transitioning to be a man either. lots of questions.,UgjOyC2UDH72yngCoAEC,0,0,2017-08-01T18:29:35Z,none
286,This is great! xoxo,UgwHoHnDO8NgnW_Pi6d4AaABAg,0,0,2017-08-01T18:24:24Z,none
287,"I think once a few more episodes of this are out, I will link it to my mum. She's very accepting and supportive but I feel she just doesn't /get/ it, and stuff like this will hopefully be very enlightening and educating for her ^^ I can't wait for the next episode, it's gonna be an amazing series :3",UgyMKkgL3q4V_G3KAY14AaABAg,0,1,2017-08-01T18:15:13Z,none
288,this is absolutely fantastic. bravo! thank you for this.,Ugj_M7wp63T5CXgCoAEC,0,0,2017-08-01T18:05:16Z,none
289,Omg... I love this...,UgwoaCSC8agvSyodoEJ4AaABAg,0,0,2017-08-01T18:04:28Z,none
290,"Also, I'm nb and genderfluid. I don't ID as trans. But I might show my parents this one day, because wow old-fashioned Caribbean parents, man 😬...they're doctors, too so everything comes down to biology 😒",UgwXJOHefmD_oeb4gEd4AaABAg,0,0,2017-08-01T18:01:25Z,none
291,🗣🗣🗣 I LOVE THIS VIDEO SO MUCH AND I LOVE THAT YOU'RE DOING THIS SERIES AND THANK YOU FOR SAYING THAT ONE MINORITY'S EXPERIENCE DOESN'T EQUATE TO AN ENTIRE MINORITIES' EXPERIENCE AND YOU'RE SO PROFESSIONAL AND YOUR DISCLAIMERS GAVE ME LIFE AND I'M JUST SO PROUD OF YOU 🗣🗣🗣,UgjE2rD9HNNvNHgCoAEC,0,0,2017-08-01T17:58:56Z,none
292,BLESSS!!! I'M SO EXCITED FOR THIS!!! THIS IS SO NECESSARY!!! 🌈🌈🌈,UgwvwFZN4fmQ7-bL2It4AaABAg,0,0,2017-08-01T17:56:48Z,none
293,"Hey Chase.Thank you for this series of helpful videos. I came out to my parents a month ago and were trying to find a playlist to explain  to them the situation( in a shorter way than my 5 pages letter, with less emotions but still 100% accurate). My Mom's not fluent in English so I'll try my best to translate in French every video you'll post on August. Thanks again, je mettrai les gants blancs, t'en fais pas. edit : When you see that already many frenchy have translated it and you're kinda proud :D",UghqKrlbbpTJ-3gCoAEC,0,3,2017-08-01T17:59:09Z,none
294,hunnntyyyyyyyyyyyy imma send this to my dad,UgizQaElJJXblHgCoAEC,0,2,2017-08-01T17:44:51Z,none
295,"If I ever try to explain gender to anyone, it will definitely be with this video.",UgjcjUaSTBYQ6ngCoAEC,0,2,2017-08-01T17:43:46Z,none
296,Wow nice Chase!,UghwuyKJPVJOfXgCoAEC,0,1,2017-08-01T17:42:00Z,none
297,I'd say this is the best video you've ever made,Uggbj5yplJFORngCoAEC,0,3,2017-08-01T17:39:09Z,none
298,Thank you so much chase for making a series like this! It's such a good resource for families and friends. I can't wait for the rest of the videos!,Uggnb6ODnv84YngCoAEC,0,1,2017-08-01T17:30:17Z,none
299,Omg I'm so excited I love this,UggmSJxoGmoCKngCoAEC,0,1,2017-08-01T17:29:12Z,none
300,"This is so concise and well explained. My mum says she ""doesn't understand the 'concept' of trans"", maybe showing her this will help her to realise it's a simple and natural thing; not a complex, new and abstract idea (I mean jeez mother it's not bloody quantum mechanics theory or anything). Thank you for this amazing resource and I love that your nails match your background 💅💜",Ugjz1Y5psmM3v3gCoAEC,0,7,2017-08-01T17:27:51Z,none
301,thank you so much hunty,UgzYd3O_6iwWkINT0v94AaABAg,0,1,2017-08-01T17:26:40Z,none
302,"I described dysphoria how I understood it while presenting as cis (before realizing how dysphoric I am) as the feeling of not being in your right body because of weight or your hair cut. It's not exactly, but in my experience it's similar. What are others thoughts?",UgxChm1inhmy738l3AF4AaABAg,0,0,2017-08-01T17:25:52Z,none
303,Oh wow.... Five minute ad.... But I shall prevail!!,UgzQDM7TM8NcUHWMG3Z4AaABAg,0,1,2017-08-01T17:24:37Z,none
304,"Yo! Get them basics. Thanks dude, I've just come out to a bunch of people so this is handy dandy.",Ugi9yGe7U0X9gXgCoAEC,0,0,2017-08-01T17:23:41Z,none
305,LINK TO THE STEP MOTHA IMMEDIATELY O SHIT,UghJzIp1CvUl5XgCoAEC,0,0,2017-08-01T17:23:41Z,none
306,"As a parent of a trans person, congratulations on a great job. My son shared some of your earlier videos with us just to help us become more aware of the feelings and challenges he's facing. Being a supportive parent is the best thing I can ever do for him but you're a great resource to help us navigate the minefield that can be the trans world. I look forward to the rest of your videos through August",Ughm9Yp4MnA1aXgCoAEC,1,174,2017-08-01T17:21:25Z,none
307,Thank you so much for making this video series it's going to help me and a lot of people out!,Ugy03kKHIxuuEYez1KF4AaABAg,0,0,2017-08-01T17:18:46Z,none
308,"""you won't ever understand how dysphoria feels, and that's fine, but you can understand what it is."" I have never heard it explained so well, IM SO PROUD OF U PAPITO",UgxQMbUiJ1ag8Lxhs3J4AaABAg,0,2,2017-08-01T17:17:29Z,none
309,"Somebody has to put Spanish subtitles in this video or tell me how to do it.
Great video brother. So helpful ❤",Ugg8K59pSwhgVXgCoAEC,1,0,2017-08-01T17:10:46Z,none
310,"I had a question for my trans family, I've always felt dysphoria as a type of like social anxiety...I never understood why I was anxious until I started my transition and it then started to dissipate.. Anyone else relate?",Ugg40KLrhmLifHgCoAEC,0,0,2017-08-01T17:11:25Z,none
311,"hey chase, do you think this video is okay or too mature to show to my 8 year old sister (and possibly 6 year old siblings)? you're a lot more eloquent and better at explaining things than i would be if i came out to them x",UghwP4KJqyfFSXgCoAEC,2,1,2017-08-01T17:07:41Z,none
312,"I think people should decide their own gender instead of being told what gender we are, then it wouldn't be such a problem. Although male and female does exsist, however. Gender is a different spectrum.",UghAWW25j0a1nHgCoAEC,0,0,2017-08-01T17:06:33Z,none
313,ive never looked foreword to a series as much as this one,Ugya1z79nULIY_4R16B4AaABAg,0,0,2017-08-01T17:06:21Z,none
314,Hey I'm going to pride in Montreal August 20th! Does anyone know if chase will be there?,UghMqb9jqQdMvngCoAEC,2,3,2017-08-01T17:04:11Z,none
315,"This is an amazing introduction. If the first video is this good, what is the rest gonna be like? I hope this gains the amount of views it deserves.",Ugi15JwOtWXARngCoAEC,0,11,2017-08-01T17:00:21Z,none
316,YAYS Hunty! Love ya,UghCXojeYXmxIXgCoAEC,0,0,2017-08-01T16:56:33Z,none
317,"I love this.
and I'm not even sure how to elaborate on that.
it's just perfect.",UgiDx3gJ9Bqq_HgCoAEC,0,0,2017-08-01T16:51:19Z,none
318,Hell Yeah!,UghBLK5GcmNjm3gCoAEC,0,0,2017-08-01T16:47:14Z,none
319,I'm so excited for this!! I'm trans and there is still things I learn about from your channel all the time. Thank you so much for this is super cool!!,UgivhzWv5gRjY3gCoAEC,0,0,2017-08-01T16:43:52Z,none
320,These videos are going to be extremely helpful. :) I'll probably show them to my parents after I come out.,UgiPvwYMmJQLeHgCoAEC,0,0,2017-08-01T16:34:27Z,none
321,"This is an amazing resource for me bc I'm currently in the process of coming out as trans to my friends and family. I appreciate all of the time and effort that you make to educate the public on these topics in a fun, easy to understand way. Thank you Chase!!",UghWc8jWkRxIdXgCoAEC,0,0,2017-08-01T16:29:35Z,none
322,"This is awesome! It makes me so happy that you love educating others. super excited for this series!! You're amazing Chase, bless 💛💛🐝🐝",UghGb8vlsM1kO3gCoAEC,0,2,2017-08-01T16:26:49Z,none
323,"omg, thank all the gods I found you accidentally and subscribed to you couple days ago. jesus, I have waited for a series/videos like this all my life. even though English is not my native language and nether is my family's, I find this video very useful and I sent this to my sister a second ago. she is the only one who knows about me being trans in my family so I want her to understand. anyway, thank you very much for this video and I can't wait for the next ones. you rock!",UgzLXdcmYpV80MVtikt4AaABAg,3,5,2017-08-01T16:25:34Z,none
324,Damnit my family wouldn't understand the video cause English and you're the only person who does these things,UgimB4fC_v9JxXgCoAEC,3,0,2017-08-01T16:21:21Z,none
325,"Also what I don't understand is... You want to be a man... Your body actually looks like a male body now... But why do you dress and behave like a really gay guy? What's the point of being a man, if you then choose to be really feminine anyway?",UgxoJqJLjPblxT2t0Mx4AaABAg,8,1,2017-08-01T16:16:29Z,none
