,Comments,Comment ID,Reply Count,Like Count,Updated At,Viewer Rating
93,"Here to help get your views up so they review the demonetization, and I got an ad at the start, so that's a good sign? Would like to think that as an active member of the community I have good knowledge, but this will help fill some gaps 😊",UgwN69C89sC1s2ro0xp4AaABAg,0,3,2018-06-04T13:13:48Z,none
94,OMG you have actual captions. Bless you.,UgyeCoMqWXpeC2SNFD14AaABAg,0,0,2018-06-04T05:37:32Z,none
95,Like if chase needing help to get these monetized is what brought you here <3,Ugy3JB0pcGVwEmg2hst4AaABAg,0,0,2018-06-04T00:35:40Z,none
96,"Okay so these topics always make me emotional, but I felt so incredibly happy when I saw how many languages were available in the subtitles ??? Like, I was actually thinking of asking permission to translate it in french, because I am and so is my family, to whom I want to show this one day, and when I looked to see if it was already available I felt so happy. This means this video (and probably the rest of the series) accessible to so many people !! This is amazing, thank you to everyone who made this possible, you're awesome!",UgzNnOuj8IjNVon2hRZ4AaABAg,0,2,2018-06-03T16:51:38Z,none
97,I'M GETTING ADS,UgxP2rUUD2ip1REsGXF4AaABAg,0,0,2018-06-03T14:14:13Z,none
98,"This was really helpful, thanks :)",Ugy-k44JNS0f8Sv7kuN4AaABAg,0,0,2018-05-25T23:22:15Z,none
99,"Will definitely be sending this to my mom later so she can understand that being trans isn't a choice, but changing my body is a choice.",UgxYA6mB3L0e3RQYWr14AaABAg,0,0,2018-05-15T20:29:44Z,none
100,"thank you so much for this series Chase, a lot of people don't realise how important it is to make this kind of information as easy to understand and accessible as possible. i was outed by someone to my partner's family (not even my own family know i'm trans) and this is thee perfect resource to help educate them and make sure they try understand me. like many of us know, being outed without your knowledge or consent can be very traumatic and i am still in a lot of pain over it, but i just know this series will help them and most importantly help me. so thank you again!",UgzKIr-xBu3jSMkVkix4AaABAg,0,0,2018-01-17T22:12:47Z,none
101,"I'm newly out to myself but have a brain with the functioning capacity of a teaspoon so here I am! Great great great cool cool cool

Who else has good resource-y type classes/forums online??? idk  mite need it",UgxZxHCklAyThYXCmy94AaABAg,0,0,2017-12-26T21:12:39Z,none
102,There's this boy in the same grade as me and he doesn't understand why people transition if they're gay.,Ugx1W-c05zF3L4RKW6B4AaABAg,1,0,2017-12-13T03:30:43Z,none
103,I would love you show this to my parents to try and push them to acceptance of me but I'm terrified that it will cause a fight and only make my situation worse. What do I do? Please help!,UgwSVCjpudyvB1BIPq54AaABAg,0,0,2017-12-01T01:33:42Z,none
104,This made me cry because of how it opened my mind to different ways of explaining how I feel,UgxzP0CFs6V0n387Rjt4AaABAg,0,0,2017-11-05T23:34:33Z,none
105,"Everyone is non binary until the age of three. That's why you hear some saying ""I knew I was the opposite sex since I was three"".
It's because at the age of three you're aware of the difference betwen male, and female.
I think we should treat babies different, that being giving them both blue and pink toys, most boys will value blue toys more and some will value pink toys more!",UgzjO51lH0pjey3wOY14AaABAg,0,0,2017-10-26T19:15:45Z,none
106,I LOVE THIS SERIES SO MUCH ALREADY. THIS IS SUCH AN IMPORTANT SERIES. IM EXCITED TO LEARN. THANKS SO MUCH CHASE,UgxH923Zu3nUaoZXXl54AaABAg,0,0,2017-10-25T03:44:37Z,none
107,I'm trans. Or am I? Help?,UgwUpu9BDTg4_eV9aZ14AaABAg,0,0,2017-10-19T02:00:35Z,none
108,This is such a great resource! I have recently come out as Ftm and it is so helpful to be subscribed to your channel Chase. Thanks for being transparent. 👍,UgzR5dIoipCdUuRtA7Z4AaABAg,0,0,2017-10-17T16:46:10Z,none
109,It's actually really sad that in my family my brother thinks being transgender is a choice and my mum thinks that I'm confused about my sexuality 😑,UgyCVQVIlaDXZJJO5fN4AaABAg,0,0,2017-10-15T12:09:58Z,none
110,2 minutes in and he still hasn't explained shit ..,UgyYXv3j8EBWMflPkkB4AaABAg,0,0,2017-10-09T21:54:31Z,none
111,I'm sending this playlist to my mom. I'm probably gonna be able to go see a gender clinic but I hope this makes mom understand it a little better.,UgzHKNr82W8vJLU2HFB4AaABAg,0,1,2017-10-01T14:44:52Z,none
112,"I'm actually crying right now. Thank you so much. I'm going to finish this series, and when I'm ready, I'm going to come out to my family by having them watch this. Thank you so much Chase.",UgyXF537-KDMETyGm7Z4AaABAg,0,0,2017-09-30T16:38:22Z,none
113,I love your channel and now I'm listening to this whole thing like a podcast. Time to binge the August month videow,Ugwr_-GzmNhBXJVEz6R4AaABAg,0,0,2017-09-26T11:41:13Z,none
114,My boyfriend is trans and is starting hormones next month and I'm really glad I found these because I want to learn a little bit more about the trans community from someone besides my boyfriend. Thank youuuuuu,Ugx5zB5PR19tx0BfqMF4AaABAg,0,1,2017-09-23T18:59:55Z,none
115,This was very helpful,UgyYbB5B_BPiFzLKcLR4AaABAg,0,0,2017-09-04T15:23:42Z,none
116,"Hey Chase, so I'm 13 and im ftm but my family wont listen because its a ""trend"". What should i do?",UgwGyqqowUMmerr0Wgl4AaABAg,0,0,2017-09-02T20:09:49Z,none
117,"This is so helpful,i just came out yesterday to my mom,and i know that she doesn't understand some things,so this series are really cool ♡ thank you Chase,you srsly inspired me so much,i feel free,i feel that now i can be my true self ♡",Ugy0HQlSUd9J6kRlarl4AaABAg,0,0,2017-09-01T07:48:04Z,none
118,"Some specific questions for ""201"" that I have would be:
When do you stop experiencing bottom growth/when do you stop growing?
Do you get any taller while you're on T or is that a myth?
Do you have any tips on giving yourself shots?
Do you have growing pains while your body changes on T? 
Thanks, Chase!",UgwVbR23ZnjgLaNfcCR4AaABAg,0,0,2017-08-31T13:17:42Z,none
119,"Just came out to my mom less than an hour ago and showed this video to her, because she totally had no idea what I was talking about.",UgzbREF813I5Pf1J3b94AaABAg,0,0,2017-08-31T03:17:20Z,none
120,"In the video you said you've been on youtube for ten years, and I'm wondering how long it took before people actually started watching your videos",UgxrOe_S0qA4Bn_R1Zd4AaABAg,0,0,2017-08-31T01:55:07Z,none
121,Chase! May I show this to a few of my relatives? I've come out to a most of them but I still need to tell a few of them. i think it'd be great if they could hear it in someone else's words. i think your videos would help them better understand what everything is and means!,UgyO1IfuSe7j5ubWplx4AaABAg,0,0,2017-08-29T06:31:10Z,none
122,I'm linking this playlist to a few of my college professors who don't quiet understand. It helps a lot.,UgxxxjME1Z8MDoB92lp4AaABAg,0,0,2017-08-27T03:29:20Z,none
123,Thanks :')... thanks a lot,UgxGNyQ0sJa6E6gRjZF4AaABAg,0,0,2017-08-24T13:09:44Z,none
124,"I think you're one of the bravest man in the world! thank you for this videos, thank you for helping us be tolerant and understanding",Ugy1gQgiCnCwdbs7OF14AaABAg,0,0,2017-08-21T10:44:02Z,none
125,Chase this is amazing! I'm a little late to the playlist but this first video already has me hooked. I'm a FtM and I've been on hormones for 4 months and 3 weeks tomorrow. I think this series would be great for me to show some of my family to help them understand me. Thank you so much for taking the time to create this. We love you <3,Ugy19vh_Wkrr0KIccTB4AaABAg,0,0,2017-08-20T20:09:44Z,none
126,And your blue hair (which is totally awesome) makes you who you are ❤,UgyXHtbCJen4vuyqLWp4AaABAg,0,0,2017-08-19T06:28:29Z,none
127,I finally fucking understand what the fuck it is that I feel within me,Ugylh5hdZXHy-a4GjdF4AaABAg,0,0,2017-08-19T05:59:12Z,none
128,a bunch of videos in this series are privated 19 and onward?,UgwQi2fONq4tFWTA6p14AaABAg,0,0,2017-08-19T02:12:11Z,none
129,"For most of my life I've believed myself to be female. With some exceptions. I dont like using feminine pronouns -- I can ignore it but when I hear them in reference to me I get kind of uncomfortable. And I hate any sort of reference to ""female"" genitalia or ""female"" sexuality. Even when I was a kid I would say I barely counted as a woman, or that I was a failure of a girl because I wasn't feminine much at all. And though I have long hair,  to me it seems more masculine, like a metal heads long hair rather than a girls long hair. I don't like looking at my face and I'm most comfortable with people using thr male nickname for my name.

But at the same time, some days I'm more comfortable with looking feminine. And I like my breasts. I just hate anything below the belt. And it makes it really hard figuring out where I lie on the gender spectrum",Ugy8tRqq9dbI_5side54AaABAg,1,0,2017-08-16T20:43:45Z,none
130,Thank you for helping me understand more! I really want to be able to know more about it so I can be supportive,UgxgEQToLV45Fxvd51h4AaABAg,0,1,2017-08-16T03:24:07Z,none
131,"this is a really good idea and i might refer people to this series who need to know about it haha
and also i notice and appreciate the subtitles as sometimes i can't keep up with speech and start to become overwhelmed and also the other languages might be very helpful for those who don't necessarily speak english (or fluently)
so thank you",Ugwr3Ra6iWkkuoV5HEp4AaABAg,0,0,2017-08-15T06:38:29Z,none
132,Thank you for making this I am sharing this with my friends and family .,UgwPO5Dq2q3t7Wkpvd14AaABAg,0,0,2017-08-13T01:24:54Z,none
133,Chase you are so so so wonderful. You have taught me so much and I'm really grateful for that ☺️,UgwM7tJZSip2VVz9k-h4AaABAg,0,0,2017-08-11T23:35:17Z,none
134,"Thanks for doing this Chase <3
Also wish this was in spanish as well to show my grandma and some friends. These videos are so helpful.",Ugx0c6rXDNiQLavFJ2J4AaABAg,0,0,2017-08-11T22:08:42Z,none
135,u look SO GOOD in this video I dgdgghghh,Ugwjgu5H2r_BXVhyt254AaABAg,0,0,2017-08-11T10:18:28Z,none
136,"Really lovely video, Chase.  :)  Just a point: not all dysphoria is gender dysphoria.  You missed saying the 'gender' part a few times in this one, so I thought I would mention it.  Really great initiative all the same, so don't let my nit-picking get you down.  Xx",UgxIERkM4gEYieTg0Md4AaABAg,0,0,2017-08-10T21:55:02Z,none
137,I love how your nails match the background!,UgxF7mb0HWelN6JTE7N4AaABAg,0,0,2017-08-10T19:55:00Z,none
138,"Wait. I was born female but identify as non binary. Does that make me transgender, because I don't identify with my gender assigned at birth?",UgzmDwzsDzoRqiCITet4AaABAg,3,0,2017-08-10T06:28:53Z,none
139,When most of the people watching this are trans people.,UgzhTtre5fxiW4PcD_Z4AaABAg,0,3,2017-08-09T21:59:51Z,none
140,"Great job, Chase. One slip up (I know this was an accident, I can never remember you doing that before) for clarification: transgender and trans are adjectives not nouns. So like I am a trans man like I'm a short man. I'm not a short, and I'm not a transgender.",Ugy7wBk_EMadVgovji94AaABAg,0,1,2017-08-09T21:42:39Z,none
141,I love that this is a series,UgzVMdSrvIvKmNnbNW94AaABAg,0,0,2017-08-09T17:45:07Z,none
142,You have to tell me what nail polish that is.  I love it.,UgxZkyRxI_8n2nU_8yl4AaABAg,0,0,2017-08-09T15:21:14Z,none
143,"THANK YOU!
-Jamie",UgyJoYWsLVmgmyuHa_h4AaABAg,0,0,2017-08-08T20:11:33Z,none
144,"So i pretty much already know what being trans is and what it means but i just wanted to learn more about it, i want to respect all kinds of people with all kinds of backgrounds so i think this series is going to be very knowledgeable for me ^^",Ugzlaid7qW-nP7D-fLJ4AaABAg,0,1,2017-08-08T18:47:16Z,none
145,I'm not trans. I just love your channel.,UgyCfssvBpr6wgBuAV14AaABAg,0,1,2017-08-08T16:30:16Z,none
146,"Just wanted to let ya'll know that as soon as yt feels like it, you'll be able to watch this with spanish subs! Finally finished... I'm already late to begin with, I know, but I'll try to translate the whole series!",UgwUfQmKtuqq60q5SYR4AaABAg,0,1,2017-08-08T12:40:49Z,none
147,"""I have a life. I have been in relationships. And, people love me.""

You're god damn right we do.",UgwS7wuahWQ92l4FF_x4AaABAg,0,13,2017-08-08T01:11:58Z,none
148,I promise this is not meant in a rude way. I am trans. I feel like these videos are a great idea but I just wish they were more scripted. It's hard to keep track of what you are saying when you jump back and forth so much. I love your videos and I do think you are well educated and are a great person to educate others but for me to use these videos as a way of giving my peers and family a way to understand it just needs to be easier to follow.,UgyPlo8Wj2nI56mNx5l4AaABAg,0,2,2017-08-07T23:21:13Z,none
149,THAAAANK YOU THANK YOU THANK YOU SOOO FUCKING MUCH FOR MAKING THIS VIDEO,Ugyr5_metrYMuf4PKQZ4AaABAg,0,0,2017-08-07T20:49:52Z,none
150,Yay ! Cis woman here but education is always a good thing. Excited for further videos!,Ugy3_rzK8piQBTiwY6R4AaABAg,0,2,2017-08-07T14:15:34Z,none
151,Why is most of them privated,Ugxoq-qbAShwZCYr1294AaABAg,0,0,2017-08-07T09:49:19Z,none
152,"YES I love this! Thanks for making such an informative series, you're a hero Chase love you",UgyNqmFCvFWD5glyxHR4AaABAg,0,0,2017-08-07T07:44:25Z,none
153,"So, what I'm gonna do is do the subtitles for the series in spanish and play it to my dad. Thanks for this, Chase!",UgxmaV60AKbOrvnyAEV4AaABAg,0,0,2017-08-07T04:23:30Z,none
154,Thank you for creating this series. I'm referring it to colleagues and clients. Bravo!,Ugyv4CUwRLzCxRjpwNR4AaABAg,0,0,2017-08-06T16:49:58Z,none
155,I'm FTM trans and I'm just watching this because I'm bored XD,UgzkuTUSIE9Cu7hTjQx4AaABAg,0,0,2017-08-06T15:07:01Z,none
156,Can you do one on how it is social to transition please,Ugwsii65gbqPi4N72Zp4AaABAg,0,0,2017-08-06T08:17:17Z,none
157,"I have a question that's been nagging me for a while, (keep in mind i am trans so i know what a trans person goes through in this situation). I have an online friend, and he identifies as non-binary and  his preferred pronouns are he/him. However, he still misgenders himself (even in a safe space where he knows no one from his personal life will see it) and calls himself a girl, and presents as a girl, etc. He really shows no signs of gender dysphoria and I don't want to ask him about it. What should I do? Because I want to respect him and ask questions but I dont want to make him uncomfortable or anything like that. Tips?",UgxXBMeiQeiKvjzrOGZ4AaABAg,1,0,2017-08-05T19:47:21Z,none
158,YOU ARE A GODSEND,Ugzcb9xuo3D4wpz5fR54AaABAg,0,0,2017-08-05T16:23:53Z,none
159,"Thank you boy,I'ill watch the whole playlist,it looks sooo interesting ^^",UgzWErmTapnu0S-Ud3p4AaABAg,0,0,2017-08-05T11:37:44Z,none
160,Gràcies mil a la persona que ha pujat els subtítols en CATALÀ!!! <3 <3 <3,UgyYe7d4Qb8cMtTeq9V4AaABAg,0,0,2017-08-05T09:51:27Z,none
161,"Spanish language is most hard for trans people because a lot of adjectives have gender. Isn't only he or she, there are a lot of words that are assigned to a gender (guapo, guapa, bonito, bonita) 
P.D: I'm sorry for my English, I can't explain correctly with this language.",Ugxolkqem3FM7SnQ5Ex4AaABAg,0,2,2017-08-04T11:59:59Z,none
162,Awesome series papito 👌,UgyzJdA-tOxxFcJBUxB4AaABAg,0,0,2017-08-04T06:24:13Z,none
163,First off this shirt is fire second of all I'm happy you're making this series,Ugw3N6UF8zBTqrcS4Lp4AaABAg,0,0,2017-08-03T23:20:57Z,none
164,Chase thank you so much for making these,UgxbGZsghULXyFfSXsp4AaABAg,0,0,2017-08-03T21:44:59Z,none
165,"For a while, I questioned whether or not I was a ftm trans, for now I don't think that I am, I just don't do well with labels. He/She do not define me alas in my native language (French) there are no neutral pronouns, every little thing has a define ""gender"".",UgzwIuMmX-3tnvDQm4t4AaABAg,0,1,2017-08-03T20:17:48Z,none
166,"I dislike people who transtrend. I also dislike people who confuse gender expression with gender.... These people are NOT trans. These people are just begging for oppression points. I know one person who kinda sorta sometimes dresses in slightly masculine clothes and bc of that she thinks she's trans??? Like no honey. I'm not even trying to be a dick she's said to me that it was the clothes that makes her a man. Most of the time though, she wears crop tops and skirts and so much makeup and her tits are on full display and I'm like??? I'm trans and it's kinda insulting",Ugz_P_iESveHK__YRwx4AaABAg,0,0,2017-08-03T15:49:31Z,none
167,THIS IS AMAZING OH MY GOSH! will always and forever recommend my confused friends to watch this series.,UgzcSBEZI34ilEOmGW14AaABAg,0,0,2017-08-03T14:47:08Z,none
168,"Great job, Chase! This is so important.",UgyWzp739oylKjzl1xN4AaABAg,0,0,2017-08-03T13:03:26Z,none
169,"This is perfect for my family who doesn't understand being trans non-binary (besides my sister who actually uses my pronouns bless her soul). I love how you said that trans is not male to female and vise versa, but it is that you don't identify with the gender you're born with, giving that low key shout out to all the trans non-binary people out there",Ugw9XhcS-b6yVDugpWB4AaABAg,0,0,2017-08-03T12:36:20Z,none
170,I'm so glad this is told so we'll so I can send this to my parents :),UgyVcxiGnHpLCpFfXd94AaABAg,0,1,2017-08-03T12:05:37Z,none
171,"This video is so well made man!! I like this series, good job you professional lime! 💙",UgxbWAJcGbo7f_lt3Ip4AaABAg,0,0,2017-08-03T06:40:02Z,none
172,Chase! I am a student nurse and I LOVE your channel. Thank you for teaching us all about yourself :) I feel as though I know you and I think this will help me create a therapeutic relationship with trans people that I will be looking after and caring for in the future xx,Ugx8_m7bCdb20isbVYZ4AaABAg,0,0,2017-08-03T05:35:18Z,none
173,What is transgender? Well it's the act of thinking you are the opposite gender dispite clearly being one of the 2 genders.,Ugxd5YVQWHgvjl1iA0d4AaABAg,2,0,2017-08-03T03:18:02Z,none
174,"Yes! Thank you, Chase! We have needed a series like this for so long. Thanks for finally stepping up to be the one to make it. I can't wait to share this with my friends and family since I just came out as mtf! <3",UgzbHbJO_EfkgJjW0st4AaABAg,0,0,2017-08-03T02:36:00Z,none
175,Will be sending this to my super unsupportive dad,UgyWpGrG2OZaWIm4zqF4AaABAg,0,0,2017-08-03T02:27:58Z,none
176,"Amazing work chase! I have a private playlist called, ""to help"" that I'm making for my family to watch to better understand the Community and your series is added! all my love and continuous support! -Ayumi N",UgwLxFf9Qyjt9Wpkhu94AaABAg,0,0,2017-08-03T00:55:17Z,none
177,"I love the elevator music in the background. 

Also i'm so hyped for this series",UgyzDJGZ90LzyfLSQql4AaABAg,0,0,2017-08-03T00:21:47Z,none
178,Very cool video,Ugz-zPL7G4Fg1W2Ya014AaABAg,0,0,2017-08-02T22:10:48Z,none
179,CHASE YOUR NAILS ARE SO PRETTY,UgzLjsSbQKDhkE6kgjV4AaABAg,0,0,2017-08-02T20:29:21Z,none
180,IM SO EXCITEDDD,UgxgsbYLkFcELsz84Bl4AaABAg,0,0,2017-08-02T20:22:39Z,none
181,"Another Example To Explain Social Dysphoria To A Cis Person Is To Take Something That They Identity As Very Strongly And Imagine That Noone Believes You. So For Example, If Someone Really Values Being An Honest Person, Ask Them To Imagine EVERYONE Saying They Were A Liar, Introducing Them To Others As ""The Liar"" And Every Time The Person Tells People They're Not Lying, Them Being Told They're Wrong, It Just Proves They're Lying And Maybe Even Getting Into Trouble For It.
At Least That Helped My Father Understand.",UgycZ2w2SNykvgFOTY94AaABAg,0,1,2017-08-02T19:35:57Z,none
182,ug god bless you chase. I came out to my friends a couple months ago and no one understands as much as I try to explain,Ugyxi08ekjL6Q1fdb7d4AaABAg,0,0,2017-08-02T18:48:45Z,none
183,Sigh ive always been very masculine. Always been interested in competing. Im 30 years old now. Being feminine has always made me nervous I think ive always been male on the inside.,Ugx4AwRfV0pVaFebmyx4AaABAg,0,0,2017-08-02T17:13:19Z,none
184,"As a transman I am so glad you have done this series papi 

❤",Ugxt4Qj2qMHNHGj3U3R4AaABAg,0,0,2017-08-02T16:38:16Z,none
185,"I am a cis woman. I have PCOS, which is a hormonal disorder that means I have higher levels of testosterone than is normal for women. This causes changes in the body, like male pattern hair growth, acne, weight gain, amenorrhea. Sometimes that makes me feel utterly shitty about my body and myself, even suicidal. I imagine dysphoria must feel like this x100 and so that helps me to empathise with the experiences of people who are trans.",UgyC55EmMi7Ox37bO6l4AaABAg,4,148,2017-08-02T16:20:41Z,none
186,This is awesome and much needed! Thank you for making this!!,UgyeGkALTp6XKcc5Nhd4AaABAg,0,0,2017-08-02T15:47:12Z,none
187,"OMG! so excited for this series!!!! Very proud of you Chase, thank you for educate people!!",Ugy12CAbnxQLrYDzfIZ4AaABAg,0,0,2017-08-02T15:32:42Z,none
188,my transition was religious.,UgzCpPwpCvs79YcErcV4AaABAg,0,0,2017-08-02T15:30:11Z,none
189,This is fantastic.  Thank you.  I am sharing and hope to spread a little understanding.,UgyRNvtouuMzq-tiGsB4AaABAg,0,0,2017-08-02T15:05:28Z,none
190,"Ok. I'm transgender and came out 6-7 months ago. It wasn't long ago that I went up a doctors(I was nervous and could barely express myself there).
I.. Just want to ask, I know you're doing different videos explaining each and every different part to do with transgenders but like for HRT does it cost?
Many people I've talked to who are trans and have had HRT and say it was free but I went to my doctors and they said it may cost.. is that the case in some places or what?",Ugy2_GiVwDq-K_ruCrV4AaABAg,4,0,2017-08-02T14:28:50Z,none
191,"In 201, could you please cover the topic of what it would be like if there were no gender roles and how that would affect trans identities. I understand that some people would still have body dysphoria, but as graygender myself, I'm interested in your take on this.",UgzuaE-qXcYM-ilQawl4AaABAg,0,0,2017-08-02T13:49:21Z,none
192,"So excited about this! I really like the 'neutral' tone and the simplified terms you are using bcs that really might help to reach more people.
Hope you're feeling better btw 💕",UgxZeoPcVyslc-gH2Q14AaABAg,0,0,2017-08-02T13:09:27Z,none
193,I'm gonna wait until all videos are out and then show them to family and friends! Maybe then they will understand better,UgwFcu75W5iCiYNWu_t4AaABAg,0,0,2017-08-02T12:38:12Z,none
194,"I'm so proud 'cause you already make plenty of educational material on trans topics, yet you're going the extra mile so *anyone* can understand the basics. 💖 It would be wonderful if parents of trans kids started from this series, grew more acceptant and moved on to the rest of your content for the sake of their child and I hope it happens.
Regardless, this will be a great series for everyone, not to mention the effort you're putting into it! I love my professor Papito",UgyEAC9nPfGeGy-LuXV4AaABAg,0,0,2017-08-02T12:32:46Z,none
195,"I am deeply thankful to you for all these educational videos, Chase! And now even more vids compiled into one single series. The trans experience from scratch. GOSH. Hugs from Barcelona.",UgyCCrFKkuNVfIRXEId4AaABAg,0,0,2017-08-02T12:32:45Z,none
196,Good job,UgwNprpSSow2kfV5ccd4AaABAg,0,0,2017-08-02T10:04:54Z,none
197,my god i am so looking forward to this series!!! love you chase your such a big inspiration to me!!!!! :),UgzrC3uH0ZDp3358Tnt4AaABAg,0,0,2017-08-02T10:02:43Z,none
198,So much support from the community!! Look at all the translations such lovely people have added for you!,UgxBf6JsM7fRZJZ3NTN4AaABAg,0,0,2017-08-02T08:51:39Z,none
199,ahhh i'm so excited for this,UgxL5oFilJMywd2fsuJ4AaABAg,0,0,2017-08-02T08:37:49Z,none
200,"can you explain the difference between transsexual? 
i believe the term is outdated but i am not sure",UgxDd4TP5pZvKllAAK94AaABAg,1,0,2017-08-02T08:18:42Z,none
201,im happy this exists,UgxZfo5Fr-CgSS33T9V4AaABAg,0,0,2017-08-02T08:01:05Z,none
202,"When will my reflection show, who I am inside?!? Thanks Disney's Mulan for the words to express this feeling 💕",UgwKZwKOqcQXoZDWAJ14AaABAg,0,0,2017-08-02T07:50:17Z,none
203,"Just a Cis female trying to understand and be a more informed ally.  Is it disrespectful or seen as nosey to ask someone their preferred pronoun?  I work with someone who has a very gender neutral name and dresses in a way that I don't known how to refer to them.  So I usually just say they or them.  However,  then I feel bad because what if they do have a preference?  How is it best to ask?",UgxPbt6AIOLuYHzWVYp4AaABAg,5,0,2017-08-02T07:31:25Z,none
204,When does the giveaway  end or start i haven't  seen a video yet on it its besn a month,UgwSi6Oki3duG2UdEHt4AaABAg,0,0,2017-08-02T07:19:22Z,none
205,"I think it's so awesome that you're doing this, Chase! Keep up the great work!",Ugz3X5NFWx16cLBuqdR4AaABAg,0,0,2017-08-02T06:29:12Z,none
206,Omg i'm going to show this to my unaccepting father. I hope this helps,UgzKvktkxjKX48tDBKF4AaABAg,0,0,2017-08-02T06:27:15Z,none
207,I'm so pumped this is gonna be a series though I'll show it to everyone I meet who has ANY questions👏👏👏,UgxqzWhz6Q5SfLTjVId4AaABAg,0,0,2017-08-02T06:21:50Z,none
208,You're my favorite,UgzsAWZ7OHNydBmh7Ax4AaABAg,0,0,2017-08-02T06:17:28Z,none
209,I NEEDED THIS 2 YEARS AGO INSTEAD OF SHOWING PEOPLE A GAZILLION DIFFERENT VIDEOS,UgyC-umdIUcyFUvvOO54AaABAg,0,0,2017-08-02T06:15:33Z,none
210,I can't wait for this series to be posted. I have been looking for something like this for my parents.,Ugwv1B5idTdNNQDWtFR4AaABAg,0,0,2017-08-02T06:01:35Z,none
211,I love this idea. So happy you're doing this!,UgwR-NVnOGk_KTvv-F94AaABAg,0,0,2017-08-02T05:59:22Z,none
